frame.number$frame.time$frame.len$eth.src$eth.dst$ip.src$ip.dst$ip.proto$ip.len$tcp.len$tcp.srcport$tcp.dstport$_ws.col.Info
1$Mar 27, 2020 20:42:27.399738022 IST$66$98:22:ef:d5:cc:2f$68:ff:7b:9c:eb:36$192.168.0.105$13.227.185.18$6$52$0$51272$443$51272 → 443 [ACK] Seq=1 Ack=1 Win=501 Len=0 TSval=1586360415 TSecr=114841473
2$Mar 27, 2020 20:42:27.414546520 IST$66$68:ff:7b:9c:eb:36$98:22:ef:d5:cc:2f$13.227.185.18$192.168.0.105$6$52$0$443$51272$[TCP ACKed unseen segment] 443 → 51272 [ACK] Seq=1 Ack=2 Win=122 Len=0 TSval=114842497 TSecr=1586268671
3$Mar 27, 2020 20:42:28.679829842 IST$66$98:22:ef:d5:cc:2f$68:ff:7b:9c:eb:36$192.168.0.105$51.89.6.202$6$52$0$40139$80$40139 → 80 [ACK] Seq=1 Ack=1 Win=501 Len=0 TSval=3912616013 TSecr=1410718683
4$Mar 27, 2020 20:42:28.873026348 IST$66$68:ff:7b:9c:eb:36$98:22:ef:d5:cc:2f$51.89.6.202$192.168.0.105$6$52$0$80$40139$[TCP ACKed unseen segment] 80 → 40139 [ACK] Seq=1 Ack=2 Win=286 Len=0 TSval=1410763739 TSecr=3912611088
5$Mar 27, 2020 20:42:31.572946253 IST$91$98:22:ef:d5:cc:2f$68:ff:7b:9c:eb:36$192.168.0.105$192.168.0.1$17$77$$$$Standard query 0xa4fe A fonts.googleapis.com OPT
6$Mar 27, 2020 20:42:31.575778602 IST$91$98:22:ef:d5:cc:2f$68:ff:7b:9c:eb:36$192.168.0.105$192.168.0.1$17$77$$$$Standard query 0xe724 AAAA fonts.googleapis.com OPT
7$Mar 27, 2020 20:42:31.588192224 IST$107$68:ff:7b:9c:eb:36$98:22:ef:d5:cc:2f$192.168.0.1$192.168.0.105$17$93$$$$Standard query response 0xa4fe A fonts.googleapis.com A 172.217.166.74 OPT
8$Mar 27, 2020 20:42:31.588337925 IST$119$68:ff:7b:9c:eb:36$98:22:ef:d5:cc:2f$192.168.0.1$192.168.0.105$17$105$$$$Standard query response 0xe724 AAAA fonts.googleapis.com AAAA 2404:6800:4009:80d::200a OPT
9$Mar 27, 2020 20:42:33.459519199 IST$74$98:22:ef:d5:cc:2f$68:ff:7b:9c:eb:36$192.168.0.105$172.217.166.74$6$60$0$39190$443$39190 → 443 [SYN] Seq=0 Win=64240 Len=0 MSS=1460 SACK_PERM=1 TSval=1523824583 TSecr=0 WS=128
10$Mar 27, 2020 20:42:33.482968160 IST$74$68:ff:7b:9c:eb:36$98:22:ef:d5:cc:2f$172.217.166.74$192.168.0.105$6$60$0$443$39190$443 → 39190 [SYN, ACK] Seq=0 Ack=1 Win=60192 Len=0 MSS=1380 SACK_PERM=1 TSval=692200534 TSecr=1523824583 WS=256
11$Mar 27, 2020 20:42:33.483002236 IST$66$98:22:ef:d5:cc:2f$68:ff:7b:9c:eb:36$192.168.0.105$172.217.166.74$6$52$0$39190$443$39190 → 443 [ACK] Seq=1 Ack=1 Win=64256 Len=0 TSval=1523824606 TSecr=692200534
12$Mar 27, 2020 20:42:33.483978880 IST$583$98:22:ef:d5:cc:2f$68:ff:7b:9c:eb:36$192.168.0.105$172.217.166.74$6$569$517$39190$443$Client Hello
13$Mar 27, 2020 20:42:33.498266783 IST$66$68:ff:7b:9c:eb:36$98:22:ef:d5:cc:2f$172.217.166.74$192.168.0.105$6$52$0$443$39190$443 → 39190 [ACK] Seq=1 Ack=518 Win=61440 Len=0 TSval=692200549 TSecr=1523824607
14$Mar 27, 2020 20:42:33.558968213 IST$2902$68:ff:7b:9c:eb:36$98:22:ef:d5:cc:2f$172.217.166.74$192.168.0.105$6$2888$2836$443$39190$Server Hello, Change Cipher Spec
15$Mar 27, 2020 20:42:33.559004889 IST$66$98:22:ef:d5:cc:2f$68:ff:7b:9c:eb:36$192.168.0.105$172.217.166.74$6$52$0$39190$443$39190 → 443 [ACK] Seq=518 Ack=2837 Win=63104 Len=0 TSval=1523824682 TSecr=692200610
16$Mar 27, 2020 20:42:33.559139658 IST$296$68:ff:7b:9c:eb:36$98:22:ef:d5:cc:2f$172.217.166.74$192.168.0.105$6$282$230$443$39190$Application Data
17$Mar 27, 2020 20:42:33.559152600 IST$66$98:22:ef:d5:cc:2f$68:ff:7b:9c:eb:36$192.168.0.105$172.217.166.74$6$52$0$39190$443$39190 → 443 [ACK] Seq=518 Ack=3067 Win=62976 Len=0 TSval=1523824682 TSecr=692200610
18$Mar 27, 2020 20:42:33.565043429 IST$84$98:22:ef:d5:cc:2f$68:ff:7b:9c:eb:36$192.168.0.105$192.168.0.1$17$70$$$$Standard query 0xc6a7 A ocsp.pki.goog OPT
19$Mar 27, 2020 20:42:33.565129574 IST$84$98:22:ef:d5:cc:2f$68:ff:7b:9c:eb:36$192.168.0.105$192.168.0.1$17$70$$$$Standard query 0x1c3b AAAA ocsp.pki.goog OPT
20$Mar 27, 2020 20:42:33.574634297 IST$135$68:ff:7b:9c:eb:36$98:22:ef:d5:cc:2f$192.168.0.1$192.168.0.105$17$121$$$$Standard query response 0xc6a7 A ocsp.pki.goog CNAME pki-goog.l.google.com A 216.58.203.163 OPT
21$Mar 27, 2020 20:42:33.575102245 IST$74$98:22:ef:d5:cc:2f$68:ff:7b:9c:eb:36$192.168.0.105$216.58.203.163$6$60$0$53294$80$53294 → 80 [SYN] Seq=0 Win=64240 Len=0 MSS=1460 SACK_PERM=1 TSval=1962952444 TSecr=0 WS=128
22$Mar 27, 2020 20:42:33.579713835 IST$147$68:ff:7b:9c:eb:36$98:22:ef:d5:cc:2f$192.168.0.1$192.168.0.105$17$133$$$$Standard query response 0x1c3b AAAA ocsp.pki.goog CNAME pki-goog.l.google.com AAAA 2404:6800:4009:803::2003 OPT
23$Mar 27, 2020 20:42:33.588816066 IST$74$68:ff:7b:9c:eb:36$98:22:ef:d5:cc:2f$216.58.203.163$192.168.0.105$6$60$0$80$53294$80 → 53294 [SYN, ACK] Seq=0 Ack=1 Win=60192 Len=0 MSS=1380 SACK_PERM=1 TSval=2467650242 TSecr=1962952444 WS=256
24$Mar 27, 2020 20:42:33.588848143 IST$66$98:22:ef:d5:cc:2f$68:ff:7b:9c:eb:36$192.168.0.105$216.58.203.163$6$52$0$53294$80$53294 → 80 [ACK] Seq=1 Ack=1 Win=64256 Len=0 TSval=1962952458 TSecr=2467650242
25$Mar 27, 2020 20:42:33.588969630 IST$448$98:22:ef:d5:cc:2f$68:ff:7b:9c:eb:36$192.168.0.105$216.58.203.163$6$434$382$53294$80$Request
26$Mar 27, 2020 20:42:33.605154693 IST$66$68:ff:7b:9c:eb:36$98:22:ef:d5:cc:2f$216.58.203.163$192.168.0.105$6$52$0$80$53294$80 → 53294 [ACK] Seq=1 Ack=383 Win=61440 Len=0 TSval=2467650258 TSecr=1962952458
27$Mar 27, 2020 20:42:33.665454360 IST$768$68:ff:7b:9c:eb:36$98:22:ef:d5:cc:2f$216.58.203.163$192.168.0.105$6$754$702$80$53294$Response
28$Mar 27, 2020 20:42:33.665479334 IST$66$98:22:ef:d5:cc:2f$68:ff:7b:9c:eb:36$192.168.0.105$216.58.203.163$6$52$0$53294$80$53294 → 80 [ACK] Seq=383 Ack=703 Win=64128 Len=0 TSval=1962952535 TSecr=2467650318
29$Mar 27, 2020 20:42:33.666634684 IST$130$98:22:ef:d5:cc:2f$68:ff:7b:9c:eb:36$192.168.0.105$172.217.166.74$6$116$64$39190$443$Change Cipher Spec, Application Data
30$Mar 27, 2020 20:42:33.668326403 IST$509$98:22:ef:d5:cc:2f$68:ff:7b:9c:eb:36$192.168.0.105$172.217.166.74$6$495$443$39190$443$Application Data, Application Data
31$Mar 27, 2020 20:42:33.685171949 IST$66$68:ff:7b:9c:eb:36$98:22:ef:d5:cc:2f$172.217.166.74$192.168.0.105$6$52$0$443$39190$443 → 39190 [ACK] Seq=3067 Ack=582 Win=61440 Len=0 TSval=692200737 TSecr=1523824790
32$Mar 27, 2020 20:42:33.685188866 IST$66$68:ff:7b:9c:eb:36$98:22:ef:d5:cc:2f$172.217.166.74$192.168.0.105$6$52$0$443$39190$443 → 39190 [ACK] Seq=3067 Ack=1025 Win=62464 Len=0 TSval=692200737 TSecr=1523824792
33$Mar 27, 2020 20:42:33.685596183 IST$646$68:ff:7b:9c:eb:36$98:22:ef:d5:cc:2f$172.217.166.74$192.168.0.105$6$632$580$443$39190$Application Data, Application Data
34$Mar 27, 2020 20:42:33.685605211 IST$66$98:22:ef:d5:cc:2f$68:ff:7b:9c:eb:36$192.168.0.105$172.217.166.74$6$52$0$39190$443$39190 → 443 [ACK] Seq=1025 Ack=3647 Win=64128 Len=0 TSval=1523824809 TSecr=692200737
35$Mar 27, 2020 20:42:33.685753544 IST$97$98:22:ef:d5:cc:2f$68:ff:7b:9c:eb:36$192.168.0.105$172.217.166.74$6$83$31$39190$443$Application Data
36$Mar 27, 2020 20:42:33.685829058 IST$97$68:ff:7b:9c:eb:36$98:22:ef:d5:cc:2f$172.217.166.74$192.168.0.105$6$83$31$443$39190$Application Data
37$Mar 27, 2020 20:42:33.705889563 IST$66$68:ff:7b:9c:eb:36$98:22:ef:d5:cc:2f$172.217.166.74$192.168.0.105$6$52$0$443$39190$443 → 39190 [ACK] Seq=3678 Ack=1056 Win=62464 Len=0 TSval=692200757 TSecr=1523824809
38$Mar 27, 2020 20:42:33.727719873 IST$66$98:22:ef:d5:cc:2f$68:ff:7b:9c:eb:36$192.168.0.105$172.217.166.74$6$52$0$39190$443$39190 → 443 [ACK] Seq=1056 Ack=3678 Win=64128 Len=0 TSval=1523824851 TSecr=692200737
39$Mar 27, 2020 20:42:33.748245639 IST$505$68:ff:7b:9c:eb:36$98:22:ef:d5:cc:2f$172.217.166.74$192.168.0.105$6$491$439$443$39190$Application Data
40$Mar 27, 2020 20:42:33.748271180 IST$66$98:22:ef:d5:cc:2f$68:ff:7b:9c:eb:36$192.168.0.105$172.217.166.74$6$52$0$39190$443$39190 → 443 [ACK] Seq=1056 Ack=4117 Win=64128 Len=0 TSval=1523824871 TSecr=692200799
41$Mar 27, 2020 20:42:33.748443124 IST$629$68:ff:7b:9c:eb:36$98:22:ef:d5:cc:2f$172.217.166.74$192.168.0.105$6$615$563$443$39190$Application Data
42$Mar 27, 2020 20:42:33.748450376 IST$66$98:22:ef:d5:cc:2f$68:ff:7b:9c:eb:36$192.168.0.105$172.217.166.74$6$52$0$39190$443$39190 → 443 [ACK] Seq=1056 Ack=4680 Win=64128 Len=0 TSval=1523824872 TSecr=692200799
43$Mar 27, 2020 20:42:33.749123648 IST$123$68:ff:7b:9c:eb:36$98:22:ef:d5:cc:2f$172.217.166.74$192.168.0.105$6$109$57$443$39190$Application Data
44$Mar 27, 2020 20:42:33.749132252 IST$66$98:22:ef:d5:cc:2f$68:ff:7b:9c:eb:36$192.168.0.105$172.217.166.74$6$52$0$39190$443$39190 → 443 [ACK] Seq=1056 Ack=4737 Win=64128 Len=0 TSval=1523824872 TSecr=692200800
45$Mar 27, 2020 20:42:33.749507299 IST$97$68:ff:7b:9c:eb:36$98:22:ef:d5:cc:2f$172.217.166.74$192.168.0.105$6$83$31$443$39190$Application Data
46$Mar 27, 2020 20:42:33.749516982 IST$66$98:22:ef:d5:cc:2f$68:ff:7b:9c:eb:36$192.168.0.105$172.217.166.74$6$52$0$39190$443$39190 → 443 [ACK] Seq=1056 Ack=4768 Win=64128 Len=0 TSval=1523824873 TSecr=692200800
47$Mar 27, 2020 20:42:33.749522802 IST$105$68:ff:7b:9c:eb:36$98:22:ef:d5:cc:2f$172.217.166.74$192.168.0.105$6$91$39$443$39190$Application Data
48$Mar 27, 2020 20:42:33.749527886 IST$66$98:22:ef:d5:cc:2f$68:ff:7b:9c:eb:36$192.168.0.105$172.217.166.74$6$52$0$39190$443$39190 → 443 [ACK] Seq=1056 Ack=4807 Win=64128 Len=0 TSval=1523824873 TSecr=692200800
49$Mar 27, 2020 20:42:33.749616197 IST$105$98:22:ef:d5:cc:2f$68:ff:7b:9c:eb:36$192.168.0.105$172.217.166.74$6$91$39$39190$443$Application Data
50$Mar 27, 2020 20:42:33.768705978 IST$66$68:ff:7b:9c:eb:36$98:22:ef:d5:cc:2f$172.217.166.74$192.168.0.105$6$52$0$443$39190$443 → 39190 [ACK] Seq=4807 Ack=1095 Win=62464 Len=0 TSval=692200820 TSecr=1523824873
51$Mar 27, 2020 20:42:33.993242038 IST$66$68:ff:7b:9c:eb:36$98:22:ef:d5:cc:2f$51.89.6.202$192.168.0.105$6$52$0$80$40139$[TCP Keep-Alive] [TCP ACKed unseen segment] 80 → 40139 [ACK] Seq=0 Ack=2 Win=286 Len=0 TSval=1410768813 TSecr=3912611088
52$Mar 27, 2020 20:42:33.993266915 IST$66$98:22:ef:d5:cc:2f$68:ff:7b:9c:eb:36$192.168.0.105$51.89.6.202$6$52$0$40139$80$[TCP Previous segment not captured] 40139 → 80 [ACK] Seq=2 Ack=1 Win=501 Len=0 TSval=3912621326 TSecr=1410763739
53$Mar 27, 2020 20:42:33.993840060 IST$103$98:22:ef:d5:cc:2f$68:ff:7b:9c:eb:36$192.168.0.105$35.167.176.149$6$89$37$54956$443$Application Data
54$Mar 27, 2020 20:42:34.300449371 IST$66$68:ff:7b:9c:eb:36$98:22:ef:d5:cc:2f$35.167.176.149$192.168.0.105$6$52$0$443$54956$443 → 54956 [ACK] Seq=1 Ack=38 Win=118 Len=0 TSval=423258317 TSecr=1752938574
55$Mar 27, 2020 20:42:34.300469975 IST$99$68:ff:7b:9c:eb:36$98:22:ef:d5:cc:2f$35.167.176.149$192.168.0.105$6$85$33$443$54956$Application Data
56$Mar 27, 2020 20:42:34.347728323 IST$66$98:22:ef:d5:cc:2f$68:ff:7b:9c:eb:36$192.168.0.105$35.167.176.149$6$52$0$54956$443$54956 → 443 [ACK] Seq=38 Ack=34 Win=501 Len=0 TSval=1752938928 TSecr=423258317
57$Mar 27, 2020 20:42:36.656361892 IST$42$68:ff:7b:9c:eb:36$98:22:ef:d5:cc:2f$$$$$$$$Who has 192.168.0.105? Tell 192.168.0.1
58$Mar 27, 2020 20:42:36.656373543 IST$42$98:22:ef:d5:cc:2f$68:ff:7b:9c:eb:36$$$$$$$$192.168.0.105 is at 98:22:ef:d5:cc:2f
59$Mar 27, 2020 20:42:37.167702692 IST$97$68:ff:7b:9c:eb:36$98:22:ef:d5:cc:2f$35.167.176.149$192.168.0.105$6$83$31$443$54956$Application Data
60$Mar 27, 2020 20:42:37.167806973 IST$66$98:22:ef:d5:cc:2f$68:ff:7b:9c:eb:36$192.168.0.105$35.167.176.149$6$52$0$54956$443$54956 → 443 [ACK] Seq=38 Ack=65 Win=501 Len=0 TSval=1752941748 TSecr=423259025
61$Mar 27, 2020 20:42:37.167940961 IST$101$98:22:ef:d5:cc:2f$68:ff:7b:9c:eb:36$192.168.0.105$35.167.176.149$6$87$35$54956$443$Application Data
62$Mar 27, 2020 20:42:37.577173993 IST$66$68:ff:7b:9c:eb:36$98:22:ef:d5:cc:2f$35.167.176.149$192.168.0.105$6$52$0$443$54956$443 → 54956 [ACK] Seq=65 Ack=73 Win=118 Len=0 TSval=423259122 TSecr=1752941748
63$Mar 27, 2020 20:42:37.639833880 IST$66$98:22:ef:d5:cc:2f$68:ff:7b:9c:eb:36$192.168.0.105$13.227.185.18$6$52$0$51272$443$[TCP Dup ACK 1#1] 51272 → 443 [ACK] Seq=1 Ack=1 Win=501 Len=0 TSval=1586370655 TSecr=114842497
64$Mar 27, 2020 20:42:37.652396745 IST$66$68:ff:7b:9c:eb:36$98:22:ef:d5:cc:2f$13.227.185.18$192.168.0.105$6$52$0$443$51272$[TCP Dup ACK 2#1] [TCP ACKed unseen segment] 443 → 51272 [ACK] Seq=1 Ack=2 Win=122 Len=0 TSval=114843521 TSecr=1586268671
65$Mar 27, 2020 20:42:39.439410503 IST$94$98:22:ef:d5:cc:2f$68:ff:7b:9c:eb:36$192.168.0.105$192.168.0.1$17$80$$$$Standard query 0xa570 AAAA googlemail.l.google.com OPT
66$Mar 27, 2020 20:42:39.448118494 IST$74$98:22:ef:d5:cc:2f$68:ff:7b:9c:eb:36$192.168.0.105$172.217.160.197$6$60$0$36344$443$36344 → 443 [SYN] Seq=0 Win=64240 Len=0 MSS=1460 SACK_PERM=1 TSval=2866792276 TSecr=0 WS=128
67$Mar 27, 2020 20:42:39.457764562 IST$122$68:ff:7b:9c:eb:36$98:22:ef:d5:cc:2f$192.168.0.1$192.168.0.105$17$108$$$$Standard query response 0xa570 AAAA googlemail.l.google.com AAAA 2404:6800:4009:80b::2005 OPT
68$Mar 27, 2020 20:42:39.461197193 IST$74$68:ff:7b:9c:eb:36$98:22:ef:d5:cc:2f$172.217.160.197$192.168.0.105$6$60$0$443$36344$443 → 36344 [SYN, ACK] Seq=0 Ack=1 Win=60192 Len=0 MSS=1380 SACK_PERM=1 TSval=1873521972 TSecr=2866792276 WS=256
69$Mar 27, 2020 20:42:39.461248889 IST$66$98:22:ef:d5:cc:2f$68:ff:7b:9c:eb:36$192.168.0.105$172.217.160.197$6$52$0$36344$443$36344 → 443 [ACK] Seq=1 Ack=1 Win=64256 Len=0 TSval=2866792289 TSecr=1873521972
70$Mar 27, 2020 20:42:39.463150956 IST$705$98:22:ef:d5:cc:2f$68:ff:7b:9c:eb:36$192.168.0.105$172.217.160.197$6$691$639$36344$443$Client Hello
71$Mar 27, 2020 20:42:39.479275622 IST$66$68:ff:7b:9c:eb:36$98:22:ef:d5:cc:2f$172.217.160.197$192.168.0.105$6$52$0$443$36344$443 → 36344 [ACK] Seq=1 Ack=640 Win=61696 Len=0 TSval=1873521990 TSecr=2866792291
72$Mar 27, 2020 20:42:39.479431343 IST$66$68:ff:7b:9c:eb:36$98:22:ef:d5:cc:2f$172.217.160.197$192.168.0.105$6$52$0$443$36344$[TCP Dup ACK 71#1] 443 → 36344 [ACK] Seq=1 Ack=640 Win=61696 Len=0 TSval=1873521990 TSecr=2866792291
73$Mar 27, 2020 20:42:39.480196415 IST$278$68:ff:7b:9c:eb:36$98:22:ef:d5:cc:2f$172.217.160.197$192.168.0.105$6$264$212$443$36344$Server Hello, Change Cipher Spec, Application Data
74$Mar 27, 2020 20:42:39.480218212 IST$66$98:22:ef:d5:cc:2f$68:ff:7b:9c:eb:36$192.168.0.105$172.217.160.197$6$52$0$36344$443$36344 → 443 [ACK] Seq=640 Ack=213 Win=64128 Len=0 TSval=2866792308 TSecr=1873521990
75$Mar 27, 2020 20:42:39.480946884 IST$130$98:22:ef:d5:cc:2f$68:ff:7b:9c:eb:36$192.168.0.105$172.217.160.197$6$116$64$36344$443$Change Cipher Spec, Application Data
76$Mar 27, 2020 20:42:39.482965260 IST$236$98:22:ef:d5:cc:2f$68:ff:7b:9c:eb:36$192.168.0.105$172.217.160.197$6$222$170$36344$443$Application Data
77$Mar 27, 2020 20:42:39.482995856 IST$1434$98:22:ef:d5:cc:2f$68:ff:7b:9c:eb:36$192.168.0.105$172.217.160.197$6$1420$1368$36344$443$[TCP segment of a reassembled PDU]
78$Mar 27, 2020 20:42:39.484561331 IST$1050$98:22:ef:d5:cc:2f$68:ff:7b:9c:eb:36$192.168.0.105$172.217.160.197$6$1036$984$36344$443$Application Data, Application Data
79$Mar 27, 2020 20:42:39.494684110 IST$646$68:ff:7b:9c:eb:36$98:22:ef:d5:cc:2f$172.217.160.197$192.168.0.105$6$632$580$443$36344$Application Data, Application Data
80$Mar 27, 2020 20:42:39.494956556 IST$97$98:22:ef:d5:cc:2f$68:ff:7b:9c:eb:36$192.168.0.105$172.217.160.197$6$83$31$36344$443$Application Data
81$Mar 27, 2020 20:42:39.499864088 IST$66$68:ff:7b:9c:eb:36$98:22:ef:d5:cc:2f$172.217.160.197$192.168.0.105$6$52$0$443$36344$443 → 36344 [ACK] Seq=793 Ack=2242 Win=65536 Len=0 TSval=1873522010 TSecr=2866792311
82$Mar 27, 2020 20:42:39.500192104 IST$97$68:ff:7b:9c:eb:36$98:22:ef:d5:cc:2f$172.217.160.197$192.168.0.105$6$83$31$443$36344$Application Data
83$Mar 27, 2020 20:42:39.504373543 IST$66$68:ff:7b:9c:eb:36$98:22:ef:d5:cc:2f$172.217.160.197$192.168.0.105$6$52$0$443$36344$443 → 36344 [ACK] Seq=824 Ack=3226 Win=68352 Len=0 TSval=1873522015 TSecr=2866792313
84$Mar 27, 2020 20:42:39.510820502 IST$66$68:ff:7b:9c:eb:36$98:22:ef:d5:cc:2f$172.217.160.197$192.168.0.105$6$52$0$443$36344$443 → 36344 [ACK] Seq=824 Ack=3257 Win=68352 Len=0 TSval=1873522021 TSecr=2866792323
85$Mar 27, 2020 20:42:39.543739682 IST$66$98:22:ef:d5:cc:2f$68:ff:7b:9c:eb:36$192.168.0.105$172.217.160.197$6$52$0$36344$443$36344 → 443 [ACK] Seq=3257 Ack=824 Win=64128 Len=0 TSval=2866792372 TSecr=1873522010
86$Mar 27, 2020 20:42:39.830240038 IST$526$68:ff:7b:9c:eb:36$98:22:ef:d5:cc:2f$172.217.160.197$192.168.0.105$6$512$460$443$36344$Application Data
87$Mar 27, 2020 20:42:39.830280054 IST$66$98:22:ef:d5:cc:2f$68:ff:7b:9c:eb:36$192.168.0.105$172.217.160.197$6$52$0$36344$443$36344 → 443 [ACK] Seq=3257 Ack=1284 Win=64128 Len=0 TSval=2866792658 TSecr=1873522315
88$Mar 27, 2020 20:42:39.830291758 IST$489$68:ff:7b:9c:eb:36$98:22:ef:d5:cc:2f$172.217.160.197$192.168.0.105$6$475$423$443$36344$Application Data
89$Mar 27, 2020 20:42:39.830300674 IST$66$98:22:ef:d5:cc:2f$68:ff:7b:9c:eb:36$192.168.0.105$172.217.160.197$6$52$0$36344$443$36344 → 443 [ACK] Seq=3257 Ack=1707 Win=64128 Len=0 TSval=2866792659 TSecr=1873522316
90$Mar 27, 2020 20:42:39.830305262 IST$305$68:ff:7b:9c:eb:36$98:22:ef:d5:cc:2f$172.217.160.197$192.168.0.105$6$291$239$443$36344$Application Data
91$Mar 27, 2020 20:42:39.830310012 IST$66$98:22:ef:d5:cc:2f$68:ff:7b:9c:eb:36$192.168.0.105$172.217.160.197$6$52$0$36344$443$36344 → 443 [ACK] Seq=3257 Ack=1946 Win=64128 Len=0 TSval=2866792659 TSecr=1873522317
92$Mar 27, 2020 20:42:39.830314453 IST$109$68:ff:7b:9c:eb:36$98:22:ef:d5:cc:2f$172.217.160.197$192.168.0.105$6$95$43$443$36344$Application Data
93$Mar 27, 2020 20:42:39.830318864 IST$66$98:22:ef:d5:cc:2f$68:ff:7b:9c:eb:36$192.168.0.105$172.217.160.197$6$52$0$36344$443$36344 → 443 [ACK] Seq=3257 Ack=1989 Win=64128 Len=0 TSval=2866792659 TSecr=1873522318
94$Mar 27, 2020 20:42:39.830323459 IST$105$68:ff:7b:9c:eb:36$98:22:ef:d5:cc:2f$172.217.160.197$192.168.0.105$6$91$39$443$36344$Application Data
95$Mar 27, 2020 20:42:39.830327845 IST$66$98:22:ef:d5:cc:2f$68:ff:7b:9c:eb:36$192.168.0.105$172.217.160.197$6$52$0$36344$443$36344 → 443 [ACK] Seq=3257 Ack=2028 Win=64128 Len=0 TSval=2866792659 TSecr=1873522318
96$Mar 27, 2020 20:42:39.830730557 IST$105$98:22:ef:d5:cc:2f$68:ff:7b:9c:eb:36$192.168.0.105$172.217.160.197$6$91$39$36344$443$Application Data
97$Mar 27, 2020 20:42:39.843084860 IST$66$68:ff:7b:9c:eb:36$98:22:ef:d5:cc:2f$172.217.160.197$192.168.0.105$6$52$0$443$36344$443 → 36344 [ACK] Seq=2028 Ack=3296 Win=68352 Len=0 TSval=1873522354 TSecr=2866792659
98$Mar 27, 2020 20:42:41.977434503 IST$118$68:ff:7b:9c:eb:36$98:22:ef:d5:cc:2f$172.217.194.189$192.168.0.105$6$104$52$443$55094$Application Data
99$Mar 27, 2020 20:42:41.977467754 IST$66$98:22:ef:d5:cc:2f$68:ff:7b:9c:eb:36$192.168.0.105$172.217.194.189$6$52$0$55094$443$55094 → 443 [ACK] Seq=1 Ack=53 Win=1695 Len=0 TSval=172897333 TSecr=3057143532
100$Mar 27, 2020 20:42:43.783735173 IST$66$98:22:ef:d5:cc:2f$68:ff:7b:9c:eb:36$192.168.0.105$216.58.203.163$6$52$0$53294$80$[TCP Keep-Alive] 53294 → 80 [ACK] Seq=382 Ack=703 Win=64128 Len=0 TSval=1962962653 TSecr=2467650318
101$Mar 27, 2020 20:42:43.797831303 IST$66$68:ff:7b:9c:eb:36$98:22:ef:d5:cc:2f$216.58.203.163$192.168.0.105$6$52$0$80$53294$[TCP Keep-Alive ACK] 80 → 53294 [ACK] Seq=703 Ack=383 Win=61440 Len=0 TSval=2467660451 TSecr=1962952535
102$Mar 27, 2020 20:42:44.234097444 IST$66$68:ff:7b:9c:eb:36$98:22:ef:d5:cc:2f$51.89.6.202$192.168.0.105$6$52$0$80$40139$[TCP Keep-Alive] [TCP ACKed unseen segment] 80 → 40139 [ACK] Seq=0 Ack=2 Win=286 Len=0 TSval=1410779049 TSecr=3912621326
103$Mar 27, 2020 20:42:44.234134530 IST$66$98:22:ef:d5:cc:2f$68:ff:7b:9c:eb:36$192.168.0.105$51.89.6.202$6$52$0$40139$80$[TCP Keep-Alive ACK] 40139 → 80 [ACK] Seq=2 Ack=1 Win=501 Len=0 TSval=3912631567 TSecr=1410763739
104$Mar 27, 2020 20:42:46.891217173 IST$118$68:ff:7b:9c:eb:36$98:22:ef:d5:cc:2f$172.217.194.189$192.168.0.105$6$104$52$443$55094$Application Data
105$Mar 27, 2020 20:42:46.891252550 IST$66$98:22:ef:d5:cc:2f$68:ff:7b:9c:eb:36$192.168.0.105$172.217.194.189$6$52$0$55094$443$55094 → 443 [ACK] Seq=1 Ack=105 Win=1695 Len=0 TSval=172902246 TSecr=3057148412
106$Mar 27, 2020 20:42:47.879792735 IST$66$98:22:ef:d5:cc:2f$68:ff:7b:9c:eb:36$192.168.0.105$13.227.185.18$6$52$0$51272$443$[TCP Dup ACK 1#2] 51272 → 443 [ACK] Seq=1 Ack=1 Win=501 Len=0 TSval=1586380895 TSecr=114843521
107$Mar 27, 2020 20:42:47.896237746 IST$66$68:ff:7b:9c:eb:36$98:22:ef:d5:cc:2f$13.227.185.18$192.168.0.105$6$52$0$443$51272$[TCP Dup ACK 2#2] [TCP ACKed unseen segment] 443 → 51272 [ACK] Seq=1 Ack=2 Win=122 Len=0 TSval=114844545 TSecr=1586268671
108$Mar 27, 2020 20:42:48.357803695 IST$166$98:22:ef:d5:cc:2f$68:ff:7b:9c:eb:36$192.168.0.105$216.58.203.163$6$152$100$48104$443$Application Data
109$Mar 27, 2020 20:42:48.376571807 IST$66$68:ff:7b:9c:eb:36$98:22:ef:d5:cc:2f$216.58.203.163$192.168.0.105$6$52$0$443$48104$443 → 48104 [ACK] Seq=1 Ack=101 Win=267 Len=0 TSval=286388083 TSecr=1962967227
110$Mar 27, 2020 20:42:48.437871640 IST$138$68:ff:7b:9c:eb:36$98:22:ef:d5:cc:2f$216.58.203.163$192.168.0.105$6$124$72$443$48104$Application Data
111$Mar 27, 2020 20:42:48.437995661 IST$140$68:ff:7b:9c:eb:36$98:22:ef:d5:cc:2f$216.58.203.163$192.168.0.105$6$126$74$443$48104$Application Data
112$Mar 27, 2020 20:42:48.438045682 IST$97$68:ff:7b:9c:eb:36$98:22:ef:d5:cc:2f$216.58.203.163$192.168.0.105$6$83$31$443$48104$Application Data
113$Mar 27, 2020 20:42:48.438056318 IST$105$68:ff:7b:9c:eb:36$98:22:ef:d5:cc:2f$216.58.203.163$192.168.0.105$6$91$39$443$48104$Application Data
114$Mar 27, 2020 20:42:48.438786351 IST$66$98:22:ef:d5:cc:2f$68:ff:7b:9c:eb:36$192.168.0.105$216.58.203.163$6$52$0$48104$443$48104 → 443 [ACK] Seq=101 Ack=217 Win=4221 Len=0 TSval=1962967308 TSecr=286388144
115$Mar 27, 2020 20:42:48.438905685 IST$105$98:22:ef:d5:cc:2f$68:ff:7b:9c:eb:36$192.168.0.105$216.58.203.163$6$91$39$48104$443$Application Data
116$Mar 27, 2020 20:42:48.451855921 IST$66$68:ff:7b:9c:eb:36$98:22:ef:d5:cc:2f$216.58.203.163$192.168.0.105$6$52$0$443$48104$443 → 48104 [ACK] Seq=217 Ack=140 Win=267 Len=0 TSval=286388158 TSecr=1962967308
117$Mar 27, 2020 20:42:48.451921538 IST$66$68:ff:7b:9c:eb:36$98:22:ef:d5:cc:2f$216.58.203.163$192.168.0.105$6$52$0$443$48104$[TCP Dup ACK 116#1] 443 → 48104 [ACK] Seq=217 Ack=140 Win=267 Len=0 TSval=286388158 TSecr=1962967308
118$Mar 27, 2020 20:42:49.249275887 IST$166$98:22:ef:d5:cc:2f$68:ff:7b:9c:eb:36$192.168.0.105$216.58.203.163$6$152$100$48104$443$Application Data
119$Mar 27, 2020 20:42:49.267042940 IST$66$68:ff:7b:9c:eb:36$98:22:ef:d5:cc:2f$216.58.203.163$192.168.0.105$6$52$0$443$48104$443 → 48104 [ACK] Seq=217 Ack=240 Win=267 Len=0 TSval=286388974 TSecr=1962968119
120$Mar 27, 2020 20:42:49.328722615 IST$138$68:ff:7b:9c:eb:36$98:22:ef:d5:cc:2f$216.58.203.163$192.168.0.105$6$124$72$443$48104$Application Data
121$Mar 27, 2020 20:42:49.328796767 IST$140$68:ff:7b:9c:eb:36$98:22:ef:d5:cc:2f$216.58.203.163$192.168.0.105$6$126$74$443$48104$Application Data
122$Mar 27, 2020 20:42:49.329012225 IST$66$98:22:ef:d5:cc:2f$68:ff:7b:9c:eb:36$192.168.0.105$216.58.203.163$6$52$0$48104$443$48104 → 443 [ACK] Seq=240 Ack=363 Win=4221 Len=0 TSval=1962968198 TSecr=286389036
123$Mar 27, 2020 20:42:49.329556410 IST$97$68:ff:7b:9c:eb:36$98:22:ef:d5:cc:2f$216.58.203.163$192.168.0.105$6$83$31$443$48104$Application Data
124$Mar 27, 2020 20:42:49.329656163 IST$105$68:ff:7b:9c:eb:36$98:22:ef:d5:cc:2f$216.58.203.163$192.168.0.105$6$91$39$443$48104$Application Data
125$Mar 27, 2020 20:42:49.329733829 IST$66$98:22:ef:d5:cc:2f$68:ff:7b:9c:eb:36$192.168.0.105$216.58.203.163$6$52$0$48104$443$48104 → 443 [ACK] Seq=240 Ack=433 Win=4221 Len=0 TSval=1962968199 TSecr=286389036
126$Mar 27, 2020 20:42:49.329768945 IST$105$98:22:ef:d5:cc:2f$68:ff:7b:9c:eb:36$192.168.0.105$216.58.203.163$6$91$39$48104$443$Application Data
127$Mar 27, 2020 20:42:49.341992677 IST$66$68:ff:7b:9c:eb:36$98:22:ef:d5:cc:2f$216.58.203.163$192.168.0.105$6$52$0$443$48104$443 → 48104 [ACK] Seq=433 Ack=279 Win=267 Len=0 TSval=286389048 TSecr=1962968199
128$Mar 27, 2020 20:42:50.947091364 IST$97$98:22:ef:d5:cc:2f$68:ff:7b:9c:eb:36$192.168.0.105$13.227.185.18$6$83$31$51272$443$[TCP Previous segment not captured] , Encrypted Alert
129$Mar 27, 2020 20:42:50.952415497 IST$66$98:22:ef:d5:cc:2f$68:ff:7b:9c:eb:36$192.168.0.105$13.227.185.18$6$52$0$51272$443$51272 → 443 [FIN, ACK] Seq=33 Ack=1 Win=501 Len=0 TSval=1586383968 TSecr=114844545
130$Mar 27, 2020 20:42:50.964428769 IST$78$68:ff:7b:9c:eb:36$98:22:ef:d5:cc:2f$13.227.185.18$192.168.0.105$6$64$0$443$51272$[TCP Dup ACK 2#3] [TCP ACKed unseen segment] 443 → 51272 [ACK] Seq=1 Ack=2 Win=122 Len=0 TSval=114844852 TSecr=1586268671 SLE=33 SRE=34
131$Mar 27, 2020 20:42:50.964480239 IST$97$98:22:ef:d5:cc:2f$68:ff:7b:9c:eb:36$192.168.0.105$13.227.185.18$6$83$31$51272$443$[TCP Fast Retransmission] , Encrypted Alert
132$Mar 27, 2020 20:42:50.972191271 IST$66$68:ff:7b:9c:eb:36$98:22:ef:d5:cc:2f$13.227.185.18$192.168.0.105$6$52$0$443$51272$443 → 51272 [ACK] Seq=1 Ack=34 Win=122 Len=0 TSval=114844853 TSecr=1586383962
133$Mar 27, 2020 20:42:50.972452357 IST$66$68:ff:7b:9c:eb:36$98:22:ef:d5:cc:2f$13.227.185.18$192.168.0.105$6$52$0$443$51272$443 → 51272 [FIN, ACK] Seq=1 Ack=34 Win=122 Len=0 TSval=114844853 TSecr=1586383962
134$Mar 27, 2020 20:42:50.972468546 IST$66$98:22:ef:d5:cc:2f$68:ff:7b:9c:eb:36$192.168.0.105$13.227.185.18$6$52$0$51272$443$51272 → 443 [ACK] Seq=34 Ack=2 Win=501 Len=0 TSval=1586383988 TSecr=114844853
135$Mar 27, 2020 20:42:50.978405261 IST$78$68:ff:7b:9c:eb:36$98:22:ef:d5:cc:2f$13.227.185.18$192.168.0.105$6$64$0$443$51272$[TCP Dup ACK 132#1] 443 → 51272 [ACK] Seq=2 Ack=34 Win=122 Len=0 TSval=114844853 TSecr=1586383962 SLE=2 SRE=33
136$Mar 27, 2020 20:42:54.023791994 IST$66$98:22:ef:d5:cc:2f$68:ff:7b:9c:eb:36$192.168.0.105$216.58.203.163$6$52$0$53294$80$[TCP Keep-Alive] 53294 → 80 [ACK] Seq=382 Ack=703 Win=64128 Len=0 TSval=1962972893 TSecr=2467660451
137$Mar 27, 2020 20:42:54.043002236 IST$66$68:ff:7b:9c:eb:36$98:22:ef:d5:cc:2f$216.58.203.163$192.168.0.105$6$52$0$80$53294$[TCP Keep-Alive ACK] 80 → 53294 [ACK] Seq=703 Ack=383 Win=61440 Len=0 TSval=2467670696 TSecr=1962952535
138$Mar 27, 2020 20:42:54.473182428 IST$66$68:ff:7b:9c:eb:36$98:22:ef:d5:cc:2f$51.89.6.202$192.168.0.105$6$52$0$80$40139$[TCP Keep-Alive] 80 → 40139 [ACK] Seq=0 Ack=2 Win=286 Len=0 TSval=1410789289 TSecr=3912631567
139$Mar 27, 2020 20:42:54.473212944 IST$66$98:22:ef:d5:cc:2f$68:ff:7b:9c:eb:36$192.168.0.105$51.89.6.202$6$52$0$40139$80$[TCP Keep-Alive ACK] 40139 → 80 [ACK] Seq=2 Ack=1 Win=501 Len=0 TSval=3912641806 TSecr=1410763739
140$Mar 27, 2020 20:43:04.263773207 IST$66$98:22:ef:d5:cc:2f$68:ff:7b:9c:eb:36$192.168.0.105$216.58.203.163$6$52$0$53294$80$[TCP Keep-Alive] 53294 → 80 [ACK] Seq=382 Ack=703 Win=64128 Len=0 TSval=1962983133 TSecr=2467670696
141$Mar 27, 2020 20:43:04.291198541 IST$66$68:ff:7b:9c:eb:36$98:22:ef:d5:cc:2f$216.58.203.163$192.168.0.105$6$52$0$80$53294$[TCP Keep-Alive ACK] 80 → 53294 [ACK] Seq=703 Ack=383 Win=61440 Len=0 TSval=2467680944 TSecr=1962952535
142$Mar 27, 2020 20:43:04.713219801 IST$66$68:ff:7b:9c:eb:36$98:22:ef:d5:cc:2f$51.89.6.202$192.168.0.105$6$52$0$80$40139$[TCP Keep-Alive] 80 → 40139 [ACK] Seq=0 Ack=2 Win=286 Len=0 TSval=1410799529 TSecr=3912641806
143$Mar 27, 2020 20:43:04.713261831 IST$66$98:22:ef:d5:cc:2f$68:ff:7b:9c:eb:36$192.168.0.105$51.89.6.202$6$52$0$40139$80$[TCP Keep-Alive ACK] 40139 → 80 [ACK] Seq=2 Ack=1 Win=501 Len=0 TSval=3912652047 TSecr=1410763739
144$Mar 27, 2020 20:43:10.076834605 IST$105$98:22:ef:d5:cc:2f$68:ff:7b:9c:eb:36$192.168.0.105$172.217.27.206$6$91$39$60962$443$Application Data
145$Mar 27, 2020 20:43:10.108285179 IST$66$68:ff:7b:9c:eb:36$98:22:ef:d5:cc:2f$172.217.27.206$192.168.0.105$6$52$0$443$60962$443 → 60962 [ACK] Seq=1 Ack=40 Win=288 Len=0 TSval=3107090193 TSecr=3344512873
146$Mar 27, 2020 20:43:10.108370020 IST$105$68:ff:7b:9c:eb:36$98:22:ef:d5:cc:2f$172.217.27.206$192.168.0.105$6$91$39$443$60962$Application Data
147$Mar 27, 2020 20:43:10.151839781 IST$66$98:22:ef:d5:cc:2f$68:ff:7b:9c:eb:36$192.168.0.105$172.217.27.206$6$52$0$60962$443$60962 → 443 [ACK] Seq=40 Ack=40 Win=501 Len=0 TSval=3344512948 TSecr=3107090193
148$Mar 27, 2020 20:43:11.478051658 IST$118$68:ff:7b:9c:eb:36$98:22:ef:d5:cc:2f$172.217.194.189$192.168.0.105$6$104$52$443$55094$Application Data
149$Mar 27, 2020 20:43:11.478074863 IST$66$98:22:ef:d5:cc:2f$68:ff:7b:9c:eb:36$192.168.0.105$172.217.194.189$6$52$0$55094$443$55094 → 443 [ACK] Seq=1 Ack=157 Win=1695 Len=0 TSval=172926833 TSecr=3057173075
150$Mar 27, 2020 20:43:13.735734977 IST$66$98:22:ef:d5:cc:2f$68:ff:7b:9c:eb:36$192.168.0.105$51.89.6.202$6$52$0$40139$80$[TCP Keep-Alive] 40139 → 80 [ACK] Seq=1 Ack=1 Win=501 Len=0 TSval=3912661069 TSecr=1410763739
151$Mar 27, 2020 20:43:14.135258453 IST$66$68:ff:7b:9c:eb:36$98:22:ef:d5:cc:2f$51.89.6.202$192.168.0.105$6$52$0$80$40139$[TCP Keep-Alive ACK] 80 → 40139 [ACK] Seq=1 Ack=2 Win=286 Len=0 TSval=1410808822 TSecr=3912652047
152$Mar 27, 2020 20:43:14.503795269 IST$66$98:22:ef:d5:cc:2f$68:ff:7b:9c:eb:36$192.168.0.105$216.58.203.163$6$52$0$53294$80$[TCP Keep-Alive] 53294 → 80 [ACK] Seq=382 Ack=703 Win=64128 Len=0 TSval=1962993373 TSecr=2467680944
153$Mar 27, 2020 20:43:14.508765492 IST$118$68:ff:7b:9c:eb:36$98:22:ef:d5:cc:2f$172.217.194.189$192.168.0.105$6$104$52$443$55094$Application Data
154$Mar 27, 2020 20:43:14.508789548 IST$66$98:22:ef:d5:cc:2f$68:ff:7b:9c:eb:36$192.168.0.105$172.217.194.189$6$52$0$55094$443$55094 → 443 [ACK] Seq=1 Ack=209 Win=1695 Len=0 TSval=172929864 TSecr=3057176123
155$Mar 27, 2020 20:43:14.524169458 IST$66$68:ff:7b:9c:eb:36$98:22:ef:d5:cc:2f$216.58.203.163$192.168.0.105$6$52$0$80$53294$[TCP Keep-Alive ACK] 80 → 53294 [ACK] Seq=703 Ack=383 Win=61440 Len=0 TSval=2467691177 TSecr=1962952535
156$Mar 27, 2020 20:43:14.954506840 IST$66$68:ff:7b:9c:eb:36$98:22:ef:d5:cc:2f$51.89.6.202$192.168.0.105$6$52$0$80$40139$[TCP Keep-Alive] 80 → 40139 [ACK] Seq=0 Ack=2 Win=286 Len=0 TSval=1410809773 TSecr=3912652047
157$Mar 27, 2020 20:43:14.954575106 IST$66$98:22:ef:d5:cc:2f$68:ff:7b:9c:eb:36$192.168.0.105$51.89.6.202$6$52$0$40139$80$[TCP Keep-Alive ACK] 40139 → 80 [ACK] Seq=2 Ack=1 Win=501 Len=0 TSval=3912662288 TSecr=1410808822
158$Mar 27, 2020 20:43:15.160300231 IST$42$68:ff:7b:9c:eb:36$98:22:ef:d5:cc:2f$$$$$$$$Who has 192.168.0.105? Tell 192.168.0.1
159$Mar 27, 2020 20:43:15.160317463 IST$42$98:22:ef:d5:cc:2f$68:ff:7b:9c:eb:36$$$$$$$$192.168.0.105 is at 98:22:ef:d5:cc:2f
160$Mar 27, 2020 20:43:19.708347245 IST$105$98:22:ef:d5:cc:2f$68:ff:7b:9c:eb:36$192.168.0.105$172.217.160.170$6$91$39$45200$443$Application Data
161$Mar 27, 2020 20:43:19.740456684 IST$105$68:ff:7b:9c:eb:36$98:22:ef:d5:cc:2f$172.217.160.170$192.168.0.105$6$91$39$443$45200$Application Data
162$Mar 27, 2020 20:43:19.783736719 IST$66$98:22:ef:d5:cc:2f$68:ff:7b:9c:eb:36$192.168.0.105$172.217.160.170$6$52$0$45200$443$45200 → 443 [ACK] Seq=40 Ack=40 Win=501 Len=0 TSval=2190670395 TSecr=3641831879
163$Mar 27, 2020 20:43:22.821190006 IST$105$98:22:ef:d5:cc:2f$68:ff:7b:9c:eb:36$192.168.0.105$172.217.166.74$6$91$39$38750$443$Application Data
164$Mar 27, 2020 20:43:22.837350792 IST$105$68:ff:7b:9c:eb:36$98:22:ef:d5:cc:2f$172.217.166.74$192.168.0.105$6$91$39$443$38750$Application Data
165$Mar 27, 2020 20:43:22.837391345 IST$66$98:22:ef:d5:cc:2f$68:ff:7b:9c:eb:36$192.168.0.105$172.217.166.74$6$52$0$38750$443$38750 → 443 [ACK] Seq=40 Ack=40 Win=501 Len=0 TSval=1523873961 TSecr=2968619612
166$Mar 27, 2020 20:43:24.743783478 IST$66$98:22:ef:d5:cc:2f$68:ff:7b:9c:eb:36$192.168.0.105$216.58.203.163$6$52$0$53294$80$[TCP Keep-Alive] 53294 → 80 [ACK] Seq=382 Ack=703 Win=64128 Len=0 TSval=1963003613 TSecr=2467691177
167$Mar 27, 2020 20:43:24.765287934 IST$66$68:ff:7b:9c:eb:36$98:22:ef:d5:cc:2f$216.58.203.163$192.168.0.105$6$52$0$80$53294$[TCP Keep-Alive ACK] 80 → 53294 [ACK] Seq=703 Ack=383 Win=61440 Len=0 TSval=2467701418 TSecr=1962952535
168$Mar 27, 2020 20:43:25.194177103 IST$66$68:ff:7b:9c:eb:36$98:22:ef:d5:cc:2f$51.89.6.202$192.168.0.105$6$52$0$80$40139$[TCP Keep-Alive] 80 → 40139 [ACK] Seq=0 Ack=2 Win=286 Len=0 TSval=1410820013 TSecr=3912662288
169$Mar 27, 2020 20:43:25.194217908 IST$66$98:22:ef:d5:cc:2f$68:ff:7b:9c:eb:36$192.168.0.105$51.89.6.202$6$52$0$40139$80$[TCP Keep-Alive ACK] 40139 → 80 [ACK] Seq=2 Ack=1 Win=501 Len=0 TSval=3912672528 TSecr=1410808822
170$Mar 27, 2020 20:43:31.761291096 IST$105$98:22:ef:d5:cc:2f$68:ff:7b:9c:eb:36$192.168.0.105$172.217.166.74$6$91$39$39190$443$Application Data
171$Mar 27, 2020 20:43:31.778364736 IST$66$68:ff:7b:9c:eb:36$98:22:ef:d5:cc:2f$172.217.166.74$192.168.0.105$6$52$0$443$39190$443 → 39190 [ACK] Seq=4807 Ack=1134 Win=62464 Len=0 TSval=692258830 TSecr=1523882885
172$Mar 27, 2020 20:43:31.778715487 IST$105$68:ff:7b:9c:eb:36$98:22:ef:d5:cc:2f$172.217.166.74$192.168.0.105$6$91$39$443$39190$Application Data
173$Mar 27, 2020 20:43:31.819786077 IST$66$98:22:ef:d5:cc:2f$68:ff:7b:9c:eb:36$192.168.0.105$172.217.166.74$6$52$0$39190$443$39190 → 443 [ACK] Seq=1134 Ack=4846 Win=64128 Len=0 TSval=1523882943 TSecr=692258830
174$Mar 27, 2020 20:43:32.357097665 IST$86$98:22:ef:d5:cc:2f$68:ff:7b:9c:eb:36$192.168.0.105$192.168.0.1$17$72$$$$Standard query 0xce6a AAAA ssl.gstatic.com OPT
175$Mar 27, 2020 20:43:32.383545661 IST$114$68:ff:7b:9c:eb:36$98:22:ef:d5:cc:2f$192.168.0.1$192.168.0.105$17$100$$$$Standard query response 0xce6a AAAA ssl.gstatic.com AAAA 2404:6800:4009:803::2003 OPT
176$Mar 27, 2020 20:43:32.593799062 IST$166$98:22:ef:d5:cc:2f$68:ff:7b:9c:eb:36$192.168.0.105$216.58.203.163$6$152$100$48104$443$Application Data
177$Mar 27, 2020 20:43:32.613580734 IST$66$68:ff:7b:9c:eb:36$98:22:ef:d5:cc:2f$216.58.203.163$192.168.0.105$6$52$0$443$48104$443 → 48104 [ACK] Seq=433 Ack=379 Win=267 Len=0 TSval=286432320 TSecr=1963011463
178$Mar 27, 2020 20:43:32.674525198 IST$138$68:ff:7b:9c:eb:36$98:22:ef:d5:cc:2f$216.58.203.163$192.168.0.105$6$124$72$443$48104$Application Data
179$Mar 27, 2020 20:43:32.674608369 IST$140$68:ff:7b:9c:eb:36$98:22:ef:d5:cc:2f$216.58.203.163$192.168.0.105$6$126$74$443$48104$Application Data
180$Mar 27, 2020 20:43:32.674820340 IST$66$98:22:ef:d5:cc:2f$68:ff:7b:9c:eb:36$192.168.0.105$216.58.203.163$6$52$0$48104$443$48104 → 443 [ACK] Seq=379 Ack=579 Win=4221 Len=0 TSval=1963011544 TSecr=286432381
181$Mar 27, 2020 20:43:32.676824448 IST$97$68:ff:7b:9c:eb:36$98:22:ef:d5:cc:2f$216.58.203.163$192.168.0.105$6$83$31$443$48104$Application Data
182$Mar 27, 2020 20:43:32.676918969 IST$105$68:ff:7b:9c:eb:36$98:22:ef:d5:cc:2f$216.58.203.163$192.168.0.105$6$91$39$443$48104$Application Data
183$Mar 27, 2020 20:43:32.677023812 IST$66$98:22:ef:d5:cc:2f$68:ff:7b:9c:eb:36$192.168.0.105$216.58.203.163$6$52$0$48104$443$48104 → 443 [ACK] Seq=379 Ack=649 Win=4221 Len=0 TSval=1963011546 TSecr=286432383
184$Mar 27, 2020 20:43:32.677062688 IST$105$98:22:ef:d5:cc:2f$68:ff:7b:9c:eb:36$192.168.0.105$216.58.203.163$6$91$39$48104$443$Application Data
185$Mar 27, 2020 20:43:32.692519664 IST$66$68:ff:7b:9c:eb:36$98:22:ef:d5:cc:2f$216.58.203.163$192.168.0.105$6$52$0$443$48104$443 → 48104 [ACK] Seq=649 Ack=418 Win=267 Len=0 TSval=286432399 TSecr=1963011546
186$Mar 27, 2020 20:43:33.292462527 IST$165$98:22:ef:d5:cc:2f$68:ff:7b:9c:eb:36$192.168.0.105$216.58.203.163$6$151$99$48104$443$Application Data
187$Mar 27, 2020 20:43:33.310483925 IST$66$68:ff:7b:9c:eb:36$98:22:ef:d5:cc:2f$216.58.203.163$192.168.0.105$6$52$0$443$48104$443 → 48104 [ACK] Seq=649 Ack=517 Win=267 Len=0 TSval=286433018 TSecr=1963012162
188$Mar 27, 2020 20:43:33.376255684 IST$138$68:ff:7b:9c:eb:36$98:22:ef:d5:cc:2f$216.58.203.163$192.168.0.105$6$124$72$443$48104$Application Data
189$Mar 27, 2020 20:43:33.376335707 IST$140$68:ff:7b:9c:eb:36$98:22:ef:d5:cc:2f$216.58.203.163$192.168.0.105$6$126$74$443$48104$Application Data
190$Mar 27, 2020 20:43:33.376455127 IST$97$68:ff:7b:9c:eb:36$98:22:ef:d5:cc:2f$216.58.203.163$192.168.0.105$6$83$31$443$48104$Application Data
191$Mar 27, 2020 20:43:33.376469572 IST$105$68:ff:7b:9c:eb:36$98:22:ef:d5:cc:2f$216.58.203.163$192.168.0.105$6$91$39$443$48104$Application Data
192$Mar 27, 2020 20:43:33.376638090 IST$66$98:22:ef:d5:cc:2f$68:ff:7b:9c:eb:36$192.168.0.105$216.58.203.163$6$52$0$48104$443$48104 → 443 [ACK] Seq=517 Ack=865 Win=4221 Len=0 TSval=1963012246 TSecr=286433083
193$Mar 27, 2020 20:43:33.376680987 IST$105$98:22:ef:d5:cc:2f$68:ff:7b:9c:eb:36$192.168.0.105$216.58.203.163$6$91$39$48104$443$Application Data
194$Mar 27, 2020 20:43:33.396688573 IST$66$68:ff:7b:9c:eb:36$98:22:ef:d5:cc:2f$216.58.203.163$192.168.0.105$6$52$0$443$48104$443 → 48104 [ACK] Seq=865 Ack=556 Win=267 Len=0 TSval=286433104 TSecr=1963012246
195$Mar 27, 2020 20:43:34.983744045 IST$66$98:22:ef:d5:cc:2f$68:ff:7b:9c:eb:36$192.168.0.105$216.58.203.163$6$52$0$53294$80$[TCP Keep-Alive] 53294 → 80 [ACK] Seq=382 Ack=703 Win=64128 Len=0 TSval=1963013853 TSecr=2467701418
196$Mar 27, 2020 20:43:35.007562244 IST$66$68:ff:7b:9c:eb:36$98:22:ef:d5:cc:2f$216.58.203.163$192.168.0.105$6$52$0$80$53294$[TCP Keep-Alive ACK] 80 → 53294 [ACK] Seq=703 Ack=383 Win=61440 Len=0 TSval=2467711661 TSecr=1962952535
197$Mar 27, 2020 20:43:35.434453878 IST$66$68:ff:7b:9c:eb:36$98:22:ef:d5:cc:2f$51.89.6.202$192.168.0.105$6$52$0$80$40139$[TCP Keep-Alive] 80 → 40139 [ACK] Seq=0 Ack=2 Win=286 Len=0 TSval=1410830253 TSecr=3912672528
198$Mar 27, 2020 20:43:35.434519834 IST$66$98:22:ef:d5:cc:2f$68:ff:7b:9c:eb:36$192.168.0.105$51.89.6.202$6$52$0$40139$80$[TCP Keep-Alive ACK] 40139 → 80 [ACK] Seq=2 Ack=1 Win=501 Len=0 TSval=3912682768 TSecr=1410808822
199$Mar 27, 2020 20:43:36.250422876 IST$118$68:ff:7b:9c:eb:36$98:22:ef:d5:cc:2f$172.217.194.189$192.168.0.105$6$104$52$443$55094$Application Data
200$Mar 27, 2020 20:43:36.250459901 IST$66$98:22:ef:d5:cc:2f$68:ff:7b:9c:eb:36$192.168.0.105$172.217.194.189$6$52$0$55094$443$55094 → 443 [ACK] Seq=1 Ack=261 Win=1695 Len=0 TSval=172951606 TSecr=3057197788
201$Mar 27, 2020 20:43:38.123490779 IST$105$98:22:ef:d5:cc:2f$68:ff:7b:9c:eb:36$192.168.0.105$172.217.160.197$6$91$39$36344$443$Application Data
202$Mar 27, 2020 20:43:38.141036710 IST$66$68:ff:7b:9c:eb:36$98:22:ef:d5:cc:2f$172.217.160.197$192.168.0.105$6$52$0$443$36344$443 → 36344 [ACK] Seq=2028 Ack=3335 Win=68352 Len=0 TSval=1873580652 TSecr=2866850952
203$Mar 27, 2020 20:43:38.141312335 IST$105$68:ff:7b:9c:eb:36$98:22:ef:d5:cc:2f$172.217.160.197$192.168.0.105$6$91$39$443$36344$Application Data
204$Mar 27, 2020 20:43:38.183731054 IST$66$98:22:ef:d5:cc:2f$68:ff:7b:9c:eb:36$192.168.0.105$172.217.160.197$6$52$0$36344$443$36344 → 443 [ACK] Seq=3335 Ack=2067 Win=64128 Len=0 TSval=2866851012 TSecr=1873580652
205$Mar 27, 2020 20:43:41.677668228 IST$118$68:ff:7b:9c:eb:36$98:22:ef:d5:cc:2f$172.217.194.189$192.168.0.105$6$104$52$443$55094$Application Data
206$Mar 27, 2020 20:43:41.677701809 IST$66$98:22:ef:d5:cc:2f$68:ff:7b:9c:eb:36$192.168.0.105$172.217.194.189$6$52$0$55094$443$55094 → 443 [ACK] Seq=1 Ack=313 Win=1695 Len=0 TSval=172957033 TSecr=3057203210
207$Mar 27, 2020 20:43:44.133782140 IST$50$68:ff:7b:9c:eb:36$01:00:5e:00:00:01$192.168.0.1$224.0.0.1$2$36$$$$Membership Query, general
208$Mar 27, 2020 20:43:44.135493790 IST$132$bc:54:36:24:16:3e$01:00:5e:00:00:fb$192.168.0.104$224.0.0.251$17$118$$$$Standard query 0x0000 PTR _homekit._tcp.local, "QU" question PTR _sleep-proxy._udp.local, "QU" question OPT
209$Mar 27, 2020 20:43:44.339725469 IST$181$30:57:14:32:da:f1$01:00:5e:00:00:fb$192.168.0.108$224.0.0.251$17$167$$$$Standard query 0x0000 PTR _homekit._tcp.local, "QU" question PTR _companion-link._tcp.local, "QU" question PTR _airplay._tcp.local, "QU" question PTR _raop._tcp.local, "QU" question PTR _sleep-proxy._udp.local, "QU" question OPT
210$Mar 27, 2020 20:43:45.158462141 IST$132$bc:54:36:24:16:3e$01:00:5e:00:00:fb$192.168.0.104$224.0.0.251$17$118$$$$Standard query 0x0000 PTR _homekit._tcp.local, "QM" question PTR _sleep-proxy._udp.local, "QM" question OPT
211$Mar 27, 2020 20:43:45.223737736 IST$66$98:22:ef:d5:cc:2f$68:ff:7b:9c:eb:36$192.168.0.105$216.58.203.163$6$52$0$53294$80$[TCP Keep-Alive] 53294 → 80 [ACK] Seq=382 Ack=703 Win=64128 Len=0 TSval=1963024093 TSecr=2467711661
212$Mar 27, 2020 20:43:45.231239603 IST$90$30:57:14:32:da:f1$98:22:ef:d5:cc:2f$$$$$$$$Multicast Listener Report Message v2
213$Mar 27, 2020 20:43:45.259288210 IST$66$68:ff:7b:9c:eb:36$98:22:ef:d5:cc:2f$216.58.203.163$192.168.0.105$6$52$0$80$53294$[TCP Keep-Alive ACK] 80 → 53294 [ACK] Seq=703 Ack=383 Win=61440 Len=0 TSval=2467721911 TSecr=1962952535
214$Mar 27, 2020 20:43:45.363364030 IST$46$30:57:14:32:da:f1$01:00:5e:00:00:02$192.168.0.108$224.0.0.2$2$32$$$$Leave Group 224.0.0.251
215$Mar 27, 2020 20:43:45.366300276 IST$46$30:57:14:32:da:f1$01:00:5e:00:00:fb$192.168.0.108$224.0.0.251$2$32$$$$Membership Report group 224.0.0.251
216$Mar 27, 2020 20:43:45.700653724 IST$66$68:ff:7b:9c:eb:36$98:22:ef:d5:cc:2f$51.89.6.202$192.168.0.105$6$52$0$80$40139$[TCP Keep-Alive] 80 → 40139 [ACK] Seq=0 Ack=2 Win=286 Len=0 TSval=1410840497 TSecr=3912682768
217$Mar 27, 2020 20:43:45.700677397 IST$66$98:22:ef:d5:cc:2f$68:ff:7b:9c:eb:36$192.168.0.105$51.89.6.202$6$52$0$40139$80$[TCP Keep-Alive ACK] 40139 → 80 [ACK] Seq=2 Ack=1 Win=501 Len=0 TSval=3912693034 TSecr=1410808822
218$Mar 27, 2020 20:43:48.230668022 IST$132$bc:54:36:24:16:3e$01:00:5e:00:00:fb$192.168.0.104$224.0.0.251$17$118$$$$Standard query 0x0000 PTR _homekit._tcp.local, "QM" question PTR _sleep-proxy._udp.local, "QM" question OPT
219$Mar 27, 2020 20:43:48.350073501 IST$90$30:57:14:32:da:f1$98:22:ef:d5:cc:2f$$$$$$$$Multicast Listener Report Message v2
220$Mar 27, 2020 20:43:48.412433441 IST$86$98:22:ef:d5:cc:2f$68:ff:7b:9c:eb:36$192.168.0.105$192.168.0.1$17$72$$$$Standard query 0x3a2e AAAA play.google.com OPT
221$Mar 27, 2020 20:43:48.435548559 IST$181$30:57:14:32:da:f1$01:00:5e:00:00:fb$192.168.0.108$224.0.0.251$17$167$$$$Standard query 0x0000 PTR _homekit._tcp.local, "QM" question PTR _companion-link._tcp.local, "QM" question PTR _airplay._tcp.local, "QM" question PTR _raop._tcp.local, "QM" question PTR _sleep-proxy._udp.local, "QM" question OPT
222$Mar 27, 2020 20:43:48.473075169 IST$114$68:ff:7b:9c:eb:36$98:22:ef:d5:cc:2f$192.168.0.1$192.168.0.105$17$100$$$$Standard query response 0x3a2e AAAA play.google.com AAAA 2404:6800:4009:800::200e OPT
223$Mar 27, 2020 20:43:48.551725967 IST$62$98:22:ef:d5:cc:2f$01:00:5e:00:00:16$192.168.0.105$224.0.0.22$2$48$$$$Membership Report / Join group 224.0.0.251 for any sources / Join group 239.255.102.18 for any sources
224$Mar 27, 2020 20:43:48.589955092 IST$304$98:22:ef:d5:cc:2f$68:ff:7b:9c:eb:36$192.168.0.105$172.217.27.206$6$290$238$60962$443$Application Data
225$Mar 27, 2020 20:43:48.591438069 IST$910$98:22:ef:d5:cc:2f$68:ff:7b:9c:eb:36$192.168.0.105$172.217.27.206$6$896$844$60962$443$Application Data, Application Data
226$Mar 27, 2020 20:43:48.618715171 IST$66$68:ff:7b:9c:eb:36$98:22:ef:d5:cc:2f$172.217.27.206$192.168.0.105$6$52$0$443$60962$443 → 60962 [ACK] Seq=40 Ack=278 Win=299 Len=0 TSval=3107128695 TSecr=3344551386
227$Mar 27, 2020 20:43:48.618737782 IST$66$68:ff:7b:9c:eb:36$98:22:ef:d5:cc:2f$172.217.27.206$192.168.0.105$6$52$0$443$60962$443 → 60962 [ACK] Seq=40 Ack=1122 Win=310 Len=0 TSval=3107128695 TSecr=3344551388
228$Mar 27, 2020 20:43:48.683818701 IST$296$68:ff:7b:9c:eb:36$98:22:ef:d5:cc:2f$172.217.27.206$192.168.0.105$6$282$230$443$60962$Application Data
229$Mar 27, 2020 20:43:48.683842210 IST$66$98:22:ef:d5:cc:2f$68:ff:7b:9c:eb:36$192.168.0.105$172.217.27.206$6$52$0$60962$443$60962 → 443 [ACK] Seq=1122 Ack=270 Win=501 Len=0 TSval=3344551480 TSecr=3107128761
230$Mar 27, 2020 20:43:48.683852962 IST$327$68:ff:7b:9c:eb:36$98:22:ef:d5:cc:2f$172.217.27.206$192.168.0.105$6$313$261$443$60962$Application Data
231$Mar 27, 2020 20:43:48.683859806 IST$66$98:22:ef:d5:cc:2f$68:ff:7b:9c:eb:36$192.168.0.105$172.217.27.206$6$52$0$60962$443$60962 → 443 [ACK] Seq=1122 Ack=531 Win=501 Len=0 TSval=3344551480 TSecr=3107128761
232$Mar 27, 2020 20:43:48.683863613 IST$129$68:ff:7b:9c:eb:36$98:22:ef:d5:cc:2f$172.217.27.206$192.168.0.105$6$115$63$443$60962$Application Data
233$Mar 27, 2020 20:43:48.683867106 IST$66$98:22:ef:d5:cc:2f$68:ff:7b:9c:eb:36$192.168.0.105$172.217.27.206$6$52$0$60962$443$60962 → 443 [ACK] Seq=1122 Ack=594 Win=501 Len=0 TSval=3344551480 TSecr=3107128761
234$Mar 27, 2020 20:43:48.683870446 IST$105$68:ff:7b:9c:eb:36$98:22:ef:d5:cc:2f$172.217.27.206$192.168.0.105$6$91$39$443$60962$Application Data
235$Mar 27, 2020 20:43:48.683873906 IST$66$98:22:ef:d5:cc:2f$68:ff:7b:9c:eb:36$192.168.0.105$172.217.27.206$6$52$0$60962$443$60962 → 443 [ACK] Seq=1122 Ack=633 Win=501 Len=0 TSval=3344551480 TSecr=3107128761
236$Mar 27, 2020 20:43:48.684149360 IST$105$98:22:ef:d5:cc:2f$68:ff:7b:9c:eb:36$192.168.0.105$172.217.27.206$6$91$39$60962$443$Application Data
237$Mar 27, 2020 20:43:48.706195458 IST$66$68:ff:7b:9c:eb:36$98:22:ef:d5:cc:2f$172.217.27.206$192.168.0.105$6$52$0$443$60962$443 → 60962 [ACK] Seq=633 Ack=1161 Win=310 Len=0 TSval=3107128789 TSecr=3344551481
238$Mar 27, 2020 20:43:50.680288283 IST$906$98:22:ef:d5:cc:2f$68:ff:7b:9c:eb:36$192.168.0.105$172.217.27.206$6$892$840$60962$443$Application Data
239$Mar 27, 2020 20:43:50.690866132 IST$246$98:22:ef:d5:cc:2f$68:ff:7b:9c:eb:36$192.168.0.105$172.217.27.206$6$232$180$60962$443$Application Data
240$Mar 27, 2020 20:43:50.703200330 IST$66$68:ff:7b:9c:eb:36$98:22:ef:d5:cc:2f$172.217.27.206$192.168.0.105$6$52$0$443$60962$443 → 60962 [ACK] Seq=633 Ack=2001 Win=320 Len=0 TSval=3107130787 TSecr=3344553477
241$Mar 27, 2020 20:43:50.709173012 IST$66$68:ff:7b:9c:eb:36$98:22:ef:d5:cc:2f$172.217.27.206$192.168.0.105$6$52$0$443$60962$443 → 60962 [ACK] Seq=633 Ack=2181 Win=331 Len=0 TSval=3107130793 TSecr=3344553487
242$Mar 27, 2020 20:43:50.773859949 IST$316$68:ff:7b:9c:eb:36$98:22:ef:d5:cc:2f$172.217.27.206$192.168.0.105$6$302$250$443$60962$Application Data
243$Mar 27, 2020 20:43:50.773880280 IST$274$68:ff:7b:9c:eb:36$98:22:ef:d5:cc:2f$172.217.27.206$192.168.0.105$6$260$208$443$60962$Application Data
244$Mar 27, 2020 20:43:50.774057668 IST$66$98:22:ef:d5:cc:2f$68:ff:7b:9c:eb:36$192.168.0.105$172.217.27.206$6$52$0$60962$443$60962 → 443 [ACK] Seq=2181 Ack=1091 Win=501 Len=0 TSval=3344553570 TSecr=3107130858
245$Mar 27, 2020 20:43:50.774343458 IST$126$68:ff:7b:9c:eb:36$98:22:ef:d5:cc:2f$172.217.27.206$192.168.0.105$6$112$60$443$60962$Application Data
246$Mar 27, 2020 20:43:50.774704414 IST$105$68:ff:7b:9c:eb:36$98:22:ef:d5:cc:2f$172.217.27.206$192.168.0.105$6$91$39$443$60962$Application Data
247$Mar 27, 2020 20:43:50.774745283 IST$66$98:22:ef:d5:cc:2f$68:ff:7b:9c:eb:36$192.168.0.105$172.217.27.206$6$52$0$60962$443$60962 → 443 [ACK] Seq=2181 Ack=1190 Win=501 Len=0 TSval=3344553571 TSecr=3107130859
248$Mar 27, 2020 20:43:50.774773563 IST$105$98:22:ef:d5:cc:2f$68:ff:7b:9c:eb:36$192.168.0.105$172.217.27.206$6$91$39$60962$443$Application Data
249$Mar 27, 2020 20:43:50.790401249 IST$66$68:ff:7b:9c:eb:36$98:22:ef:d5:cc:2f$172.217.27.206$192.168.0.105$6$52$0$443$60962$443 → 60962 [ACK] Seq=1190 Ack=2220 Win=331 Len=0 TSval=3107130871 TSecr=3344553571
250$Mar 27, 2020 20:43:51.683674618 IST$100$98:22:ef:d5:cc:2f$68:ff:7b:9c:eb:36$192.168.0.105$192.168.0.1$17$86$$$$Standard query 0x2c52 A people-pa.clients6.google.com OPT
251$Mar 27, 2020 20:43:51.686174373 IST$408$98:22:ef:d5:cc:2f$68:ff:7b:9c:eb:36$192.168.0.105$172.217.166.74$6$394$342$38750$443$Application Data
252$Mar 27, 2020 20:43:51.686280952 IST$100$98:22:ef:d5:cc:2f$68:ff:7b:9c:eb:36$192.168.0.105$192.168.0.1$17$86$$$$Standard query 0x33ff AAAA people-pa.clients6.google.com OPT
253$Mar 27, 2020 20:43:51.688968508 IST$728$98:22:ef:d5:cc:2f$68:ff:7b:9c:eb:36$192.168.0.105$172.217.166.74$6$714$662$38750$443$Application Data
254$Mar 27, 2020 20:43:51.698272981 IST$116$68:ff:7b:9c:eb:36$98:22:ef:d5:cc:2f$192.168.0.1$192.168.0.105$17$102$$$$Standard query response 0x2c52 A people-pa.clients6.google.com A 216.58.203.170 OPT
255$Mar 27, 2020 20:43:51.698359356 IST$128$68:ff:7b:9c:eb:36$98:22:ef:d5:cc:2f$192.168.0.1$192.168.0.105$17$114$$$$Standard query response 0x33ff AAAA people-pa.clients6.google.com AAAA 2404:6800:4009:80a::200a OPT
256$Mar 27, 2020 20:43:51.710955679 IST$66$68:ff:7b:9c:eb:36$98:22:ef:d5:cc:2f$172.217.166.74$192.168.0.105$6$52$0$443$38750$443 → 38750 [ACK] Seq=40 Ack=1044 Win=289 Len=0 TSval=2968648483 TSecr=1523902807
257$Mar 27, 2020 20:43:52.127008501 IST$329$68:ff:7b:9c:eb:36$98:22:ef:d5:cc:2f$172.217.166.74$192.168.0.105$6$315$263$443$38750$Application Data
258$Mar 27, 2020 20:43:52.127048752 IST$66$98:22:ef:d5:cc:2f$68:ff:7b:9c:eb:36$192.168.0.105$172.217.166.74$6$52$0$38750$443$38750 → 443 [ACK] Seq=1044 Ack=303 Win=501 Len=0 TSval=1523903250 TSecr=2968648794
259$Mar 27, 2020 20:43:52.127062590 IST$352$68:ff:7b:9c:eb:36$98:22:ef:d5:cc:2f$172.217.166.74$192.168.0.105$6$338$286$443$38750$Application Data
260$Mar 27, 2020 20:43:52.127071750 IST$66$98:22:ef:d5:cc:2f$68:ff:7b:9c:eb:36$192.168.0.105$172.217.166.74$6$52$0$38750$443$38750 → 443 [ACK] Seq=1044 Ack=589 Win=501 Len=0 TSval=1523903250 TSecr=2968648794
261$Mar 27, 2020 20:43:52.127077240 IST$231$68:ff:7b:9c:eb:36$98:22:ef:d5:cc:2f$172.217.166.74$192.168.0.105$6$217$165$443$38750$Application Data
262$Mar 27, 2020 20:43:52.127082685 IST$66$98:22:ef:d5:cc:2f$68:ff:7b:9c:eb:36$192.168.0.105$172.217.166.74$6$52$0$38750$443$38750 → 443 [ACK] Seq=1044 Ack=754 Win=501 Len=0 TSval=1523903250 TSecr=2968648795
263$Mar 27, 2020 20:43:52.127087630 IST$105$68:ff:7b:9c:eb:36$98:22:ef:d5:cc:2f$172.217.166.74$192.168.0.105$6$91$39$443$38750$Application Data
264$Mar 27, 2020 20:43:52.127091794 IST$66$98:22:ef:d5:cc:2f$68:ff:7b:9c:eb:36$192.168.0.105$172.217.166.74$6$52$0$38750$443$38750 → 443 [ACK] Seq=1044 Ack=793 Win=501 Len=0 TSval=1523903250 TSecr=2968648795
265$Mar 27, 2020 20:43:52.127095456 IST$105$68:ff:7b:9c:eb:36$98:22:ef:d5:cc:2f$172.217.166.74$192.168.0.105$6$91$39$443$38750$[TCP Spurious Retransmission] , Application Data
266$Mar 27, 2020 20:43:52.127101339 IST$78$98:22:ef:d5:cc:2f$68:ff:7b:9c:eb:36$192.168.0.105$172.217.166.74$6$64$0$38750$443$[TCP Dup ACK 264#1] 38750 → 443 [ACK] Seq=1044 Ack=793 Win=501 Len=0 TSval=1523903251 TSecr=2968648896 SLE=754 SRE=793
267$Mar 27, 2020 20:43:52.127449405 IST$105$98:22:ef:d5:cc:2f$68:ff:7b:9c:eb:36$192.168.0.105$172.217.166.74$6$91$39$38750$443$Application Data
268$Mar 27, 2020 20:43:52.157176868 IST$66$68:ff:7b:9c:eb:36$98:22:ef:d5:cc:2f$172.217.166.74$192.168.0.105$6$52$0$443$38750$443 → 38750 [ACK] Seq=793 Ack=1083 Win=289 Len=0 TSval=2968648933 TSecr=1523903251
269$Mar 27, 2020 20:43:55.148631443 IST$305$98:22:ef:d5:cc:2f$68:ff:7b:9c:eb:36$192.168.0.105$172.217.27.206$6$291$239$60962$443$Application Data
270$Mar 27, 2020 20:43:55.154018659 IST$966$98:22:ef:d5:cc:2f$68:ff:7b:9c:eb:36$192.168.0.105$172.217.27.206$6$952$900$60962$443$Application Data, Application Data
271$Mar 27, 2020 20:43:55.165682624 IST$66$68:ff:7b:9c:eb:36$98:22:ef:d5:cc:2f$172.217.27.206$192.168.0.105$6$52$0$443$60962$443 → 60962 [ACK] Seq=1190 Ack=2459 Win=342 Len=0 TSval=3107135250 TSecr=3344557945
272$Mar 27, 2020 20:43:55.171244143 IST$66$68:ff:7b:9c:eb:36$98:22:ef:d5:cc:2f$172.217.27.206$192.168.0.105$6$52$0$443$60962$443 → 60962 [ACK] Seq=1190 Ack=3359 Win=352 Len=0 TSval=3107135256 TSecr=3344557950
273$Mar 27, 2020 20:43:55.235647148 IST$296$68:ff:7b:9c:eb:36$98:22:ef:d5:cc:2f$172.217.27.206$192.168.0.105$6$282$230$443$60962$Application Data
274$Mar 27, 2020 20:43:55.235755989 IST$443$68:ff:7b:9c:eb:36$98:22:ef:d5:cc:2f$172.217.27.206$192.168.0.105$6$429$377$443$60962$Application Data
275$Mar 27, 2020 20:43:55.235776753 IST$66$98:22:ef:d5:cc:2f$68:ff:7b:9c:eb:36$192.168.0.105$172.217.27.206$6$52$0$60962$443$60962 → 443 [ACK] Seq=3359 Ack=1797 Win=501 Len=0 TSval=3344558032 TSecr=3107135320
276$Mar 27, 2020 20:43:55.236544837 IST$210$68:ff:7b:9c:eb:36$98:22:ef:d5:cc:2f$172.217.27.206$192.168.0.105$6$196$144$443$60962$Application Data
277$Mar 27, 2020 20:43:55.236668150 IST$105$68:ff:7b:9c:eb:36$98:22:ef:d5:cc:2f$172.217.27.206$192.168.0.105$6$91$39$443$60962$Application Data
278$Mar 27, 2020 20:43:55.236716396 IST$66$98:22:ef:d5:cc:2f$68:ff:7b:9c:eb:36$192.168.0.105$172.217.27.206$6$52$0$60962$443$60962 → 443 [ACK] Seq=3359 Ack=1980 Win=501 Len=0 TSval=3344558033 TSecr=3107135321
279$Mar 27, 2020 20:43:55.236750130 IST$105$98:22:ef:d5:cc:2f$68:ff:7b:9c:eb:36$192.168.0.105$172.217.27.206$6$91$39$60962$443$Application Data
280$Mar 27, 2020 20:43:55.252797346 IST$66$68:ff:7b:9c:eb:36$98:22:ef:d5:cc:2f$172.217.27.206$192.168.0.105$6$52$0$443$60962$443 → 60962 [ACK] Seq=1980 Ack=3398 Win=352 Len=0 TSval=3107135337 TSecr=3344558033
281$Mar 27, 2020 20:43:55.463740542 IST$66$98:22:ef:d5:cc:2f$68:ff:7b:9c:eb:36$192.168.0.105$216.58.203.163$6$52$0$53294$80$[TCP Keep-Alive] 53294 → 80 [ACK] Seq=382 Ack=703 Win=64128 Len=0 TSval=1963034333 TSecr=2467721911
282$Mar 27, 2020 20:43:55.486835608 IST$66$68:ff:7b:9c:eb:36$98:22:ef:d5:cc:2f$216.58.203.163$192.168.0.105$6$52$0$80$53294$[TCP Keep-Alive ACK] 80 → 53294 [ACK] Seq=703 Ack=383 Win=61440 Len=0 TSval=2467732140 TSecr=1962952535
283$Mar 27, 2020 20:43:55.915471751 IST$66$68:ff:7b:9c:eb:36$98:22:ef:d5:cc:2f$51.89.6.202$192.168.0.105$6$52$0$80$40139$[TCP Keep-Alive] 80 → 40139 [ACK] Seq=0 Ack=2 Win=286 Len=0 TSval=1410850756 TSecr=3912693034
284$Mar 27, 2020 20:43:55.915496973 IST$66$98:22:ef:d5:cc:2f$68:ff:7b:9c:eb:36$192.168.0.105$51.89.6.202$6$52$0$40139$80$[TCP Keep-Alive ACK] 40139 → 80 [ACK] Seq=2 Ack=1 Win=501 Len=0 TSval=3912703249 TSecr=1410808822
285$Mar 27, 2020 20:43:57.241777595 IST$132$bc:54:36:24:16:3e$01:00:5e:00:00:fb$192.168.0.104$224.0.0.251$17$118$$$$Standard query 0x0000 PTR _homekit._tcp.local, "QM" question PTR _sleep-proxy._udp.local, "QM" question OPT
286$Mar 27, 2020 20:43:57.446979306 IST$181$30:57:14:32:da:f1$01:00:5e:00:00:fb$192.168.0.108$224.0.0.251$17$167$$$$Standard query 0x0000 PTR _homekit._tcp.local, "QM" question PTR _companion-link._tcp.local, "QM" question PTR _airplay._tcp.local, "QM" question PTR _raop._tcp.local, "QM" question PTR _sleep-proxy._udp.local, "QM" question OPT
287$Mar 27, 2020 20:43:58.791730361 IST$66$98:22:ef:d5:cc:2f$68:ff:7b:9c:eb:36$192.168.0.105$51.89.6.202$6$52$0$40139$80$[TCP Keep-Alive] 40139 → 80 [ACK] Seq=1 Ack=1 Win=501 Len=0 TSval=3912706125 TSecr=1410808822
288$Mar 27, 2020 20:43:58.987827729 IST$66$68:ff:7b:9c:eb:36$98:22:ef:d5:cc:2f$51.89.6.202$192.168.0.105$6$52$0$80$40139$[TCP Keep-Alive ACK] 80 → 40139 [ACK] Seq=1 Ack=2 Win=286 Len=0 TSval=1410853851 TSecr=3912703249
289$Mar 27, 2020 20:43:59.244134935 IST$866$98:22:ef:d5:cc:2f$68:ff:7b:9c:eb:36$192.168.0.105$172.217.27.206$6$852$800$60962$443$Application Data
290$Mar 27, 2020 20:43:59.250247709 IST$222$98:22:ef:d5:cc:2f$68:ff:7b:9c:eb:36$192.168.0.105$172.217.27.206$6$208$156$60962$443$Application Data
291$Mar 27, 2020 20:43:59.261967685 IST$66$68:ff:7b:9c:eb:36$98:22:ef:d5:cc:2f$172.217.27.206$192.168.0.105$6$52$0$443$60962$443 → 60962 [ACK] Seq=1980 Ack=4198 Win=363 Len=0 TSval=3107139346 TSecr=3344562041
292$Mar 27, 2020 20:43:59.266407351 IST$66$68:ff:7b:9c:eb:36$98:22:ef:d5:cc:2f$172.217.27.206$192.168.0.105$6$52$0$443$60962$443 → 60962 [ACK] Seq=1980 Ack=4354 Win=374 Len=0 TSval=3107139351 TSecr=3344562047
293$Mar 27, 2020 20:43:59.331815243 IST$297$68:ff:7b:9c:eb:36$98:22:ef:d5:cc:2f$172.217.27.206$192.168.0.105$6$283$231$443$60962$Application Data
294$Mar 27, 2020 20:43:59.331874209 IST$458$68:ff:7b:9c:eb:36$98:22:ef:d5:cc:2f$172.217.27.206$192.168.0.105$6$444$392$443$60962$Application Data
295$Mar 27, 2020 20:43:59.331886460 IST$66$98:22:ef:d5:cc:2f$68:ff:7b:9c:eb:36$192.168.0.105$172.217.27.206$6$52$0$60962$443$60962 → 443 [ACK] Seq=4354 Ack=2603 Win=501 Len=0 TSval=3344562128 TSecr=3107139416
296$Mar 27, 2020 20:43:59.332849469 IST$139$68:ff:7b:9c:eb:36$98:22:ef:d5:cc:2f$172.217.27.206$192.168.0.105$6$125$73$443$60962$Application Data
297$Mar 27, 2020 20:43:59.332859355 IST$105$68:ff:7b:9c:eb:36$98:22:ef:d5:cc:2f$172.217.27.206$192.168.0.105$6$91$39$443$60962$Application Data
298$Mar 27, 2020 20:43:59.332948736 IST$66$98:22:ef:d5:cc:2f$68:ff:7b:9c:eb:36$192.168.0.105$172.217.27.206$6$52$0$60962$443$60962 → 443 [ACK] Seq=4354 Ack=2715 Win=501 Len=0 TSval=3344562129 TSecr=3107139417
299$Mar 27, 2020 20:43:59.332970542 IST$105$98:22:ef:d5:cc:2f$68:ff:7b:9c:eb:36$192.168.0.105$172.217.27.206$6$91$39$60962$443$Application Data
300$Mar 27, 2020 20:43:59.354892544 IST$66$68:ff:7b:9c:eb:36$98:22:ef:d5:cc:2f$172.217.27.206$192.168.0.105$6$52$0$443$60962$443 → 60962 [ACK] Seq=2715 Ack=4393 Win=374 Len=0 TSval=3107139439 TSecr=3344562129
301$Mar 27, 2020 20:44:00.279420825 IST$899$98:22:ef:d5:cc:2f$68:ff:7b:9c:eb:36$192.168.0.105$172.217.166.74$6$885$833$38750$443$Application Data
302$Mar 27, 2020 20:44:00.284666172 IST$728$98:22:ef:d5:cc:2f$68:ff:7b:9c:eb:36$192.168.0.105$172.217.166.74$6$714$662$38750$443$Application Data
303$Mar 27, 2020 20:44:00.298952178 IST$66$68:ff:7b:9c:eb:36$98:22:ef:d5:cc:2f$172.217.166.74$192.168.0.105$6$52$0$443$38750$443 → 38750 [ACK] Seq=793 Ack=1916 Win=299 Len=0 TSval=2968657074 TSecr=1523911403
304$Mar 27, 2020 20:44:00.303275814 IST$66$68:ff:7b:9c:eb:36$98:22:ef:d5:cc:2f$172.217.166.74$192.168.0.105$6$52$0$443$38750$443 → 38750 [ACK] Seq=793 Ack=2578 Win=310 Len=0 TSval=2968657080 TSecr=1523911408
305$Mar 27, 2020 20:44:00.624707675 IST$118$68:ff:7b:9c:eb:36$98:22:ef:d5:cc:2f$172.217.194.189$192.168.0.105$6$104$52$443$55094$Application Data
306$Mar 27, 2020 20:44:00.624770768 IST$66$98:22:ef:d5:cc:2f$68:ff:7b:9c:eb:36$192.168.0.105$172.217.194.189$6$52$0$55094$443$55094 → 443 [ACK] Seq=1 Ack=365 Win=1695 Len=0 TSval=172975980 TSecr=3057222183
307$Mar 27, 2020 20:44:00.632103908 IST$302$68:ff:7b:9c:eb:36$98:22:ef:d5:cc:2f$172.217.166.74$192.168.0.105$6$288$236$443$38750$Application Data
308$Mar 27, 2020 20:44:00.632344587 IST$465$68:ff:7b:9c:eb:36$98:22:ef:d5:cc:2f$172.217.166.74$192.168.0.105$6$451$399$443$38750$Application Data, Application Data
309$Mar 27, 2020 20:44:00.632364064 IST$105$68:ff:7b:9c:eb:36$98:22:ef:d5:cc:2f$172.217.166.74$192.168.0.105$6$91$39$443$38750$Application Data
310$Mar 27, 2020 20:44:00.632390768 IST$66$98:22:ef:d5:cc:2f$68:ff:7b:9c:eb:36$192.168.0.105$172.217.166.74$6$52$0$38750$443$38750 → 443 [ACK] Seq=2578 Ack=1467 Win=501 Len=0 TSval=1523911756 TSecr=2968657409
311$Mar 27, 2020 20:44:00.633145876 IST$105$98:22:ef:d5:cc:2f$68:ff:7b:9c:eb:36$192.168.0.105$172.217.166.74$6$91$39$38750$443$Application Data
312$Mar 27, 2020 20:44:00.647162315 IST$66$68:ff:7b:9c:eb:36$98:22:ef:d5:cc:2f$172.217.166.74$192.168.0.105$6$52$0$443$38750$443 → 38750 [ACK] Seq=1467 Ack=2617 Win=310 Len=0 TSval=2968657424 TSecr=1523911757
313$Mar 27, 2020 20:44:05.337514197 IST$42$68:ff:7b:9c:eb:36$98:22:ef:d5:cc:2f$$$$$$$$Who has 192.168.0.105? Tell 192.168.0.1
314$Mar 27, 2020 20:44:05.337533211 IST$42$98:22:ef:d5:cc:2f$68:ff:7b:9c:eb:36$$$$$$$$192.168.0.105 is at 98:22:ef:d5:cc:2f
315$Mar 27, 2020 20:44:05.703739201 IST$66$98:22:ef:d5:cc:2f$68:ff:7b:9c:eb:36$192.168.0.105$216.58.203.163$6$52$0$53294$80$[TCP Keep-Alive] 53294 → 80 [ACK] Seq=382 Ack=703 Win=64128 Len=0 TSval=1963044573 TSecr=2467732140
316$Mar 27, 2020 20:44:05.724016952 IST$66$68:ff:7b:9c:eb:36$98:22:ef:d5:cc:2f$216.58.203.163$192.168.0.105$6$52$0$80$53294$[TCP Keep-Alive ACK] 80 → 53294 [ACK] Seq=703 Ack=383 Win=61440 Len=0 TSval=2467742377 TSecr=1962952535
317$Mar 27, 2020 20:44:05.817365569 IST$118$68:ff:7b:9c:eb:36$98:22:ef:d5:cc:2f$172.217.194.189$192.168.0.105$6$104$52$443$55094$Application Data
318$Mar 27, 2020 20:44:05.817412695 IST$66$98:22:ef:d5:cc:2f$68:ff:7b:9c:eb:36$192.168.0.105$172.217.194.189$6$52$0$55094$443$55094 → 443 [ACK] Seq=1 Ack=417 Win=1695 Len=0 TSval=172981173 TSecr=3057227459
319$Mar 27, 2020 20:44:05.817477712 IST$97$68:ff:7b:9c:eb:36$98:22:ef:d5:cc:2f$172.217.194.189$192.168.0.105$6$83$31$443$55094$Application Data
320$Mar 27, 2020 20:44:05.817493813 IST$66$98:22:ef:d5:cc:2f$68:ff:7b:9c:eb:36$192.168.0.105$172.217.194.189$6$52$0$55094$443$55094 → 443 [ACK] Seq=1 Ack=448 Win=1695 Len=0 TSval=172981173 TSecr=3057227460
321$Mar 27, 2020 20:44:05.817502101 IST$105$68:ff:7b:9c:eb:36$98:22:ef:d5:cc:2f$172.217.194.189$192.168.0.105$6$91$39$443$55094$Application Data
322$Mar 27, 2020 20:44:05.817508569 IST$66$98:22:ef:d5:cc:2f$68:ff:7b:9c:eb:36$192.168.0.105$172.217.194.189$6$52$0$55094$443$55094 → 443 [ACK] Seq=1 Ack=487 Win=1695 Len=0 TSval=172981173 TSecr=3057227460
323$Mar 27, 2020 20:44:05.817685948 IST$105$98:22:ef:d5:cc:2f$68:ff:7b:9c:eb:36$192.168.0.105$172.217.194.189$6$91$39$55094$443$Application Data
324$Mar 27, 2020 20:44:05.910362371 IST$66$68:ff:7b:9c:eb:36$98:22:ef:d5:cc:2f$172.217.194.189$192.168.0.105$6$52$0$443$55094$443 → 55094 [ACK] Seq=487 Ack=40 Win=813 Len=0 TSval=3057227544 TSecr=172981173
325$Mar 27, 2020 20:44:06.156084609 IST$66$68:ff:7b:9c:eb:36$98:22:ef:d5:cc:2f$51.89.6.202$192.168.0.105$6$52$0$80$40139$[TCP Keep-Alive] 80 → 40139 [ACK] Seq=0 Ack=2 Win=286 Len=0 TSval=1410860972 TSecr=3912703249
326$Mar 27, 2020 20:44:06.156135162 IST$66$98:22:ef:d5:cc:2f$68:ff:7b:9c:eb:36$192.168.0.105$51.89.6.202$6$52$0$40139$80$[TCP Keep-Alive ACK] 40139 → 80 [ACK] Seq=2 Ack=1 Win=501 Len=0 TSval=3912713490 TSecr=1410853851
327$Mar 27, 2020 20:44:07.316257749 IST$98$98:22:ef:d5:cc:2f$68:ff:7b:9c:eb:36$192.168.0.105$192.168.0.1$17$84$$$$Standard query 0x491d A 0.client-channel.google.com OPT
328$Mar 27, 2020 20:44:07.318720147 IST$575$98:22:ef:d5:cc:2f$68:ff:7b:9c:eb:36$192.168.0.105$172.217.194.189$6$561$509$55094$443$Application Data
329$Mar 27, 2020 20:44:07.319023380 IST$98$98:22:ef:d5:cc:2f$68:ff:7b:9c:eb:36$192.168.0.105$192.168.0.1$17$84$$$$Standard query 0x4364 AAAA 0.client-channel.google.com OPT
330$Mar 27, 2020 20:44:07.330868787 IST$114$68:ff:7b:9c:eb:36$98:22:ef:d5:cc:2f$192.168.0.1$192.168.0.105$17$100$$$$Standard query response 0x491d A 0.client-channel.google.com A 172.217.194.189 OPT
331$Mar 27, 2020 20:44:07.330900228 IST$126$68:ff:7b:9c:eb:36$98:22:ef:d5:cc:2f$192.168.0.1$192.168.0.105$17$112$$$$Standard query response 0x4364 AAAA 0.client-channel.google.com AAAA 2404:6800:4003:c04::bd OPT
332$Mar 27, 2020 20:44:07.388831827 IST$66$68:ff:7b:9c:eb:36$98:22:ef:d5:cc:2f$172.217.194.189$192.168.0.105$6$52$0$443$55094$443 → 55094 [ACK] Seq=487 Ack=549 Win=824 Len=0 TSval=3057229031 TSecr=172982672
333$Mar 27, 2020 20:44:07.395434454 IST$270$68:ff:7b:9c:eb:36$98:22:ef:d5:cc:2f$172.217.194.189$192.168.0.105$6$256$204$443$55094$Application Data
334$Mar 27, 2020 20:44:07.395502928 IST$118$68:ff:7b:9c:eb:36$98:22:ef:d5:cc:2f$172.217.194.189$192.168.0.105$6$104$52$443$55094$Application Data
335$Mar 27, 2020 20:44:07.395786598 IST$66$98:22:ef:d5:cc:2f$68:ff:7b:9c:eb:36$192.168.0.105$172.217.194.189$6$52$0$55094$443$55094 → 443 [ACK] Seq=549 Ack=743 Win=1695 Len=0 TSval=172982751 TSecr=3057229038
336$Mar 27, 2020 20:44:15.570739634 IST$42$30:e3:7a:0d:3a:86$ff:ff:ff:ff:ff:ff$$$$$$$$Who has 169.254.169.254? Tell 192.168.0.106
337$Mar 27, 2020 20:44:15.943788348 IST$66$98:22:ef:d5:cc:2f$68:ff:7b:9c:eb:36$192.168.0.105$216.58.203.163$6$52$0$53294$80$[TCP Keep-Alive] 53294 → 80 [ACK] Seq=382 Ack=703 Win=64128 Len=0 TSval=1963054813 TSecr=2467742377
338$Mar 27, 2020 20:44:15.976153076 IST$66$68:ff:7b:9c:eb:36$98:22:ef:d5:cc:2f$216.58.203.163$192.168.0.105$6$52$0$80$53294$[TCP Keep-Alive ACK] 80 → 53294 [ACK] Seq=703 Ack=383 Win=61440 Len=0 TSval=2467752629 TSecr=1962952535
339$Mar 27, 2020 20:44:16.395710910 IST$66$68:ff:7b:9c:eb:36$98:22:ef:d5:cc:2f$51.89.6.202$192.168.0.105$6$52$0$80$40139$[TCP Keep-Alive] 80 → 40139 [ACK] Seq=0 Ack=2 Win=286 Len=0 TSval=1410871220 TSecr=3912713490
340$Mar 27, 2020 20:44:16.395748130 IST$66$98:22:ef:d5:cc:2f$68:ff:7b:9c:eb:36$192.168.0.105$51.89.6.202$6$52$0$40139$80$[TCP Keep-Alive ACK] 40139 → 80 [ACK] Seq=2 Ack=1 Win=501 Len=0 TSval=3912723729 TSecr=1410853851
341$Mar 27, 2020 20:44:16.492047807 IST$42$30:e3:7a:0d:3a:86$ff:ff:ff:ff:ff:ff$$$$$$$$Who has 169.254.169.254? Tell 192.168.0.106
342$Mar 27, 2020 20:44:17.516334212 IST$42$30:e3:7a:0d:3a:86$ff:ff:ff:ff:ff:ff$$$$$$$$Who has 169.254.169.254? Tell 192.168.0.106
343$Mar 27, 2020 20:44:17.893602985 IST$105$98:22:ef:d5:cc:2f$68:ff:7b:9c:eb:36$192.168.0.105$172.217.160.170$6$91$39$45200$443$Application Data
344$Mar 27, 2020 20:44:17.908799415 IST$105$68:ff:7b:9c:eb:36$98:22:ef:d5:cc:2f$172.217.160.170$192.168.0.105$6$91$39$443$45200$Application Data
345$Mar 27, 2020 20:44:17.908842318 IST$66$98:22:ef:d5:cc:2f$68:ff:7b:9c:eb:36$192.168.0.105$172.217.160.170$6$52$0$45200$443$45200 → 443 [ACK] Seq=79 Ack=79 Win=501 Len=0 TSval=2190728520 TSecr=3641890048
346$Mar 27, 2020 20:44:24.275475528 IST$132$bc:54:36:24:16:3e$01:00:5e:00:00:fb$192.168.0.104$224.0.0.251$17$118$$$$Standard query 0x0000 PTR _homekit._tcp.local, "QM" question PTR _sleep-proxy._udp.local, "QM" question OPT
347$Mar 27, 2020 20:44:25.914687936 IST$118$68:ff:7b:9c:eb:36$98:22:ef:d5:cc:2f$172.217.194.189$192.168.0.105$6$104$52$443$55094$Application Data
348$Mar 27, 2020 20:44:25.955737794 IST$66$98:22:ef:d5:cc:2f$68:ff:7b:9c:eb:36$192.168.0.105$172.217.194.189$6$52$0$55094$443$55094 → 443 [ACK] Seq=549 Ack=795 Win=1695 Len=0 TSval=173001311 TSecr=3057247477
349$Mar 27, 2020 20:44:26.183736805 IST$66$98:22:ef:d5:cc:2f$68:ff:7b:9c:eb:36$192.168.0.105$216.58.203.163$6$52$0$53294$80$[TCP Keep-Alive] 53294 → 80 [ACK] Seq=382 Ack=703 Win=64128 Len=0 TSval=1963065053 TSecr=2467752629
350$Mar 27, 2020 20:44:26.203815994 IST$66$68:ff:7b:9c:eb:36$98:22:ef:d5:cc:2f$216.58.203.163$192.168.0.105$6$52$0$80$53294$[TCP Keep-Alive ACK] 80 → 53294 [ACK] Seq=703 Ack=383 Win=61440 Len=0 TSval=2467762857 TSecr=1962952535
351$Mar 27, 2020 20:44:26.635542937 IST$66$68:ff:7b:9c:eb:36$98:22:ef:d5:cc:2f$51.89.6.202$192.168.0.105$6$52$0$80$40139$[TCP Keep-Alive] 80 → 40139 [ACK] Seq=0 Ack=2 Win=286 Len=0 TSval=1410881472 TSecr=3912723729
352$Mar 27, 2020 20:44:26.635581361 IST$66$98:22:ef:d5:cc:2f$68:ff:7b:9c:eb:36$192.168.0.105$51.89.6.202$6$52$0$40139$80$[TCP Keep-Alive ACK] 40139 → 80 [ACK] Seq=2 Ack=1 Win=501 Len=0 TSval=3912733969 TSecr=1410853851
353$Mar 27, 2020 20:44:28.955477544 IST$66$98:22:ef:d5:cc:2f$68:ff:7b:9c:eb:36$192.168.0.105$216.58.203.163$6$52$0$53294$80$53294 → 80 [FIN, ACK] Seq=383 Ack=703 Win=64128 Len=0 TSval=1963067825 TSecr=2467762857
354$Mar 27, 2020 20:44:28.974559367 IST$66$68:ff:7b:9c:eb:36$98:22:ef:d5:cc:2f$216.58.203.163$192.168.0.105$6$52$0$80$53294$80 → 53294 [FIN, ACK] Seq=703 Ack=384 Win=61440 Len=0 TSval=2467765628 TSecr=1963067825
355$Mar 27, 2020 20:44:28.974597937 IST$66$98:22:ef:d5:cc:2f$68:ff:7b:9c:eb:36$192.168.0.105$216.58.203.163$6$52$0$53294$80$53294 → 80 [ACK] Seq=384 Ack=704 Win=64128 Len=0 TSval=1963067844 TSecr=2467765628
356$Mar 27, 2020 20:44:30.092790833 IST$105$98:22:ef:d5:cc:2f$68:ff:7b:9c:eb:36$192.168.0.105$172.217.166.74$6$91$39$39190$443$Application Data
357$Mar 27, 2020 20:44:30.115140120 IST$105$68:ff:7b:9c:eb:36$98:22:ef:d5:cc:2f$172.217.166.74$192.168.0.105$6$91$39$443$39190$Application Data
358$Mar 27, 2020 20:44:30.115192906 IST$66$98:22:ef:d5:cc:2f$68:ff:7b:9c:eb:36$192.168.0.105$172.217.166.74$6$52$0$39190$443$39190 → 443 [ACK] Seq=1173 Ack=4885 Win=64128 Len=0 TSval=1523941239 TSecr=692317167
359$Mar 27, 2020 20:44:30.651412761 IST$166$98:22:ef:d5:cc:2f$68:ff:7b:9c:eb:36$192.168.0.105$216.58.203.163$6$152$100$48104$443$Application Data
360$Mar 27, 2020 20:44:30.673188878 IST$66$68:ff:7b:9c:eb:36$98:22:ef:d5:cc:2f$216.58.203.163$192.168.0.105$6$52$0$443$48104$443 → 48104 [ACK] Seq=865 Ack=656 Win=267 Len=0 TSval=286490380 TSecr=1963069521
361$Mar 27, 2020 20:44:30.740169111 IST$138$68:ff:7b:9c:eb:36$98:22:ef:d5:cc:2f$216.58.203.163$192.168.0.105$6$124$72$443$48104$Application Data
362$Mar 27, 2020 20:44:30.740246487 IST$140$68:ff:7b:9c:eb:36$98:22:ef:d5:cc:2f$216.58.203.163$192.168.0.105$6$126$74$443$48104$Application Data
363$Mar 27, 2020 20:44:30.740320467 IST$97$68:ff:7b:9c:eb:36$98:22:ef:d5:cc:2f$216.58.203.163$192.168.0.105$6$83$31$443$48104$Application Data
364$Mar 27, 2020 20:44:30.740550869 IST$105$68:ff:7b:9c:eb:36$98:22:ef:d5:cc:2f$216.58.203.163$192.168.0.105$6$91$39$443$48104$Application Data
365$Mar 27, 2020 20:44:30.740726648 IST$66$98:22:ef:d5:cc:2f$68:ff:7b:9c:eb:36$192.168.0.105$216.58.203.163$6$52$0$48104$443$48104 → 443 [ACK] Seq=656 Ack=1081 Win=4221 Len=0 TSval=1963069610 TSecr=286490447
366$Mar 27, 2020 20:44:30.740766546 IST$105$98:22:ef:d5:cc:2f$68:ff:7b:9c:eb:36$192.168.0.105$216.58.203.163$6$91$39$48104$443$Application Data
367$Mar 27, 2020 20:44:30.756665236 IST$66$68:ff:7b:9c:eb:36$98:22:ef:d5:cc:2f$216.58.203.163$192.168.0.105$6$52$0$443$48104$443 → 48104 [ACK] Seq=1081 Ack=695 Win=267 Len=0 TSval=286490463 TSecr=1963069610
368$Mar 27, 2020 20:44:30.756724876 IST$66$68:ff:7b:9c:eb:36$98:22:ef:d5:cc:2f$216.58.203.163$192.168.0.105$6$52$0$443$48104$[TCP Dup ACK 367#1] 443 → 48104 [ACK] Seq=1081 Ack=695 Win=267 Len=0 TSval=286490463 TSecr=1963069610
369$Mar 27, 2020 20:44:31.670555738 IST$165$98:22:ef:d5:cc:2f$68:ff:7b:9c:eb:36$192.168.0.105$216.58.203.163$6$151$99$48104$443$Application Data
370$Mar 27, 2020 20:44:31.688377411 IST$66$68:ff:7b:9c:eb:36$98:22:ef:d5:cc:2f$216.58.203.163$192.168.0.105$6$52$0$443$48104$443 → 48104 [ACK] Seq=1081 Ack=794 Win=267 Len=0 TSval=286491395 TSecr=1963070540
371$Mar 27, 2020 20:44:31.749306533 IST$138$68:ff:7b:9c:eb:36$98:22:ef:d5:cc:2f$216.58.203.163$192.168.0.105$6$124$72$443$48104$Application Data
372$Mar 27, 2020 20:44:31.749402089 IST$140$68:ff:7b:9c:eb:36$98:22:ef:d5:cc:2f$216.58.203.163$192.168.0.105$6$126$74$443$48104$Application Data
373$Mar 27, 2020 20:44:31.749745098 IST$66$98:22:ef:d5:cc:2f$68:ff:7b:9c:eb:36$192.168.0.105$216.58.203.163$6$52$0$48104$443$48104 → 443 [ACK] Seq=794 Ack=1227 Win=4221 Len=0 TSval=1963070619 TSecr=286491456
374$Mar 27, 2020 20:44:31.750367286 IST$97$68:ff:7b:9c:eb:36$98:22:ef:d5:cc:2f$216.58.203.163$192.168.0.105$6$83$31$443$48104$Application Data
375$Mar 27, 2020 20:44:31.750560266 IST$105$68:ff:7b:9c:eb:36$98:22:ef:d5:cc:2f$216.58.203.163$192.168.0.105$6$91$39$443$48104$Application Data
376$Mar 27, 2020 20:44:31.750613182 IST$66$98:22:ef:d5:cc:2f$68:ff:7b:9c:eb:36$192.168.0.105$216.58.203.163$6$52$0$48104$443$48104 → 443 [ACK] Seq=794 Ack=1297 Win=4221 Len=0 TSval=1963070620 TSecr=286491457
377$Mar 27, 2020 20:44:31.750663989 IST$105$98:22:ef:d5:cc:2f$68:ff:7b:9c:eb:36$192.168.0.105$216.58.203.163$6$91$39$48104$443$Application Data
378$Mar 27, 2020 20:44:31.764423675 IST$66$68:ff:7b:9c:eb:36$98:22:ef:d5:cc:2f$216.58.203.163$192.168.0.105$6$52$0$443$48104$443 → 48104 [ACK] Seq=1297 Ack=833 Win=267 Len=0 TSval=286491471 TSecr=1963070620
379$Mar 27, 2020 20:44:31.764487926 IST$66$68:ff:7b:9c:eb:36$98:22:ef:d5:cc:2f$216.58.203.163$192.168.0.105$6$52$0$443$48104$[TCP Dup ACK 378#1] 443 → 48104 [ACK] Seq=1297 Ack=833 Win=267 Len=0 TSval=286491471 TSecr=1963070620
380$Mar 27, 2020 20:44:32.965715985 IST$100$98:22:ef:d5:cc:2f$68:ff:7b:9c:eb:36$192.168.0.105$192.168.0.1$17$86$$$$Standard query 0x10ed A connectivity-check.ubuntu.com OPT
381$Mar 27, 2020 20:44:32.986034900 IST$132$68:ff:7b:9c:eb:36$98:22:ef:d5:cc:2f$192.168.0.1$192.168.0.105$17$118$$$$Standard query response 0x10ed A connectivity-check.ubuntu.com A 35.222.85.5 A 35.224.99.156 OPT
382$Mar 27, 2020 20:44:33.966692127 IST$74$98:22:ef:d5:cc:2f$68:ff:7b:9c:eb:36$192.168.0.105$35.222.85.5$6$60$0$53664$80$53664 → 80 [SYN] Seq=0 Win=64240 Len=0 MSS=1460 SACK_PERM=1 TSval=3089491084 TSecr=0 WS=128
383$Mar 27, 2020 20:44:33.972647634 IST$118$68:ff:7b:9c:eb:36$98:22:ef:d5:cc:2f$172.217.194.189$192.168.0.105$6$104$52$443$55094$Application Data
384$Mar 27, 2020 20:44:33.972679394 IST$66$98:22:ef:d5:cc:2f$68:ff:7b:9c:eb:36$192.168.0.105$172.217.194.189$6$52$0$55094$443$55094 → 443 [ACK] Seq=549 Ack=847 Win=1695 Len=0 TSval=173009328 TSecr=3057255611
385$Mar 27, 2020 20:44:34.315661790 IST$74$68:ff:7b:9c:eb:36$98:22:ef:d5:cc:2f$35.222.85.5$192.168.0.105$6$60$0$80$53664$80 → 53664 [SYN, ACK] Seq=0 Ack=1 Win=28160 Len=0 MSS=1420 SACK_PERM=1 TSval=3768593717 TSecr=3089491084 WS=128
386$Mar 27, 2020 20:44:34.315729957 IST$66$98:22:ef:d5:cc:2f$68:ff:7b:9c:eb:36$192.168.0.105$35.222.85.5$6$52$0$53664$80$53664 → 80 [ACK] Seq=1 Ack=1 Win=64256 Len=0 TSval=3089491433 TSecr=3768593717
387$Mar 27, 2020 20:44:34.315846563 IST$153$98:22:ef:d5:cc:2f$68:ff:7b:9c:eb:36$192.168.0.105$35.222.85.5$6$139$87$53664$80$GET / HTTP/1.1 
388$Mar 27, 2020 20:44:34.622779570 IST$66$68:ff:7b:9c:eb:36$98:22:ef:d5:cc:2f$35.222.85.5$192.168.0.105$6$52$0$80$53664$80 → 53664 [ACK] Seq=1 Ack=88 Win=29312 Len=0 TSval=3768594114 TSecr=3089491433
389$Mar 27, 2020 20:44:34.622817334 IST$214$68:ff:7b:9c:eb:36$98:22:ef:d5:cc:2f$35.222.85.5$192.168.0.105$6$200$148$80$53664$HTTP/1.1 204 No Content 
390$Mar 27, 2020 20:44:34.622836007 IST$66$98:22:ef:d5:cc:2f$68:ff:7b:9c:eb:36$192.168.0.105$35.222.85.5$6$52$0$53664$80$53664 → 80 [ACK] Seq=88 Ack=149 Win=64128 Len=0 TSval=3089491740 TSecr=3768594115
391$Mar 27, 2020 20:44:34.622853089 IST$66$68:ff:7b:9c:eb:36$98:22:ef:d5:cc:2f$35.222.85.5$192.168.0.105$6$52$0$80$53664$80 → 53664 [FIN, ACK] Seq=149 Ack=88 Win=29312 Len=0 TSval=3768594115 TSecr=3089491433
392$Mar 27, 2020 20:44:34.622994224 IST$66$98:22:ef:d5:cc:2f$68:ff:7b:9c:eb:36$192.168.0.105$35.222.85.5$6$52$0$53664$80$53664 → 80 [FIN, ACK] Seq=88 Ack=150 Win=64128 Len=0 TSval=3089491740 TSecr=3768594115
393$Mar 27, 2020 20:44:34.930111210 IST$66$68:ff:7b:9c:eb:36$98:22:ef:d5:cc:2f$35.222.85.5$192.168.0.105$6$52$0$80$53664$80 → 53664 [ACK] Seq=150 Ack=89 Win=29312 Len=0 TSval=3768594420 TSecr=3089491740
394$Mar 27, 2020 20:44:36.661298063 IST$105$98:22:ef:d5:cc:2f$68:ff:7b:9c:eb:36$192.168.0.105$172.217.160.197$6$91$39$36344$443$Application Data
395$Mar 27, 2020 20:44:36.684408615 IST$105$68:ff:7b:9c:eb:36$98:22:ef:d5:cc:2f$172.217.160.197$192.168.0.105$6$91$39$443$36344$Application Data
396$Mar 27, 2020 20:44:36.684459318 IST$66$98:22:ef:d5:cc:2f$68:ff:7b:9c:eb:36$192.168.0.105$172.217.160.197$6$52$0$36344$443$36344 → 443 [ACK] Seq=3374 Ack=2106 Win=64128 Len=0 TSval=2866909513 TSecr=1873639195
397$Mar 27, 2020 20:44:36.770713652 IST$66$68:ff:7b:9c:eb:36$98:22:ef:d5:cc:2f$51.89.6.202$192.168.0.105$6$52$0$80$40139$[TCP Keep-Alive] 80 → 40139 [ACK] Seq=0 Ack=2 Win=286 Len=0 TSval=1410891692 TSecr=3912733969
398$Mar 27, 2020 20:44:36.770748996 IST$66$98:22:ef:d5:cc:2f$68:ff:7b:9c:eb:36$192.168.0.105$51.89.6.202$6$52$0$40139$80$[TCP Keep-Alive ACK] 40139 → 80 [ACK] Seq=2 Ack=1 Win=501 Len=0 TSval=3912744104 TSecr=1410853851
399$Mar 27, 2020 20:44:43.847776133 IST$66$98:22:ef:d5:cc:2f$68:ff:7b:9c:eb:36$192.168.0.105$51.89.6.202$6$52$0$40139$80$[TCP Keep-Alive] 40139 → 80 [ACK] Seq=1 Ack=1 Win=501 Len=0 TSval=3912751181 TSecr=1410853851
400$Mar 27, 2020 20:44:44.038690883 IST$66$68:ff:7b:9c:eb:36$98:22:ef:d5:cc:2f$51.89.6.202$192.168.0.105$6$52$0$80$40139$[TCP Keep-Alive ACK] 80 → 40139 [ACK] Seq=1 Ack=2 Win=286 Len=0 TSval=1410898909 TSecr=3912744104
401$Mar 27, 2020 20:44:47.111567520 IST$66$68:ff:7b:9c:eb:36$98:22:ef:d5:cc:2f$51.89.6.202$192.168.0.105$6$52$0$80$40139$[TCP Keep-Alive] 80 → 40139 [ACK] Seq=0 Ack=2 Win=286 Len=0 TSval=1410901900 TSecr=3912744104
402$Mar 27, 2020 20:44:47.111594893 IST$66$98:22:ef:d5:cc:2f$68:ff:7b:9c:eb:36$192.168.0.105$51.89.6.202$6$52$0$40139$80$[TCP Keep-Alive ACK] 40139 → 80 [ACK] Seq=2 Ack=1 Win=501 Len=0 TSval=3912754445 TSecr=1410898909
