frame.number$frame.time$frame.len$eth.src$eth.dst$ip.src$ip.dst$ip.proto$ip.len$tcp.len$tcp.srcport$tcp.dstport$_ws.col.Info
1$Mar 28, 2020 23:37:41.290758584 IST$66$68:ff:7b:9c:eb:36$98:22:ef:d5:cc:2f$172.217.166.42$192.168.0.105$6$52$0$443$35548$443 → 35548 [ACK] Seq=1 Ack=1 Win=261 Len=0 TSval=2000019283 TSecr=1185243377
2$Mar 28, 2020 23:37:41.323846105 IST$66$98:22:ef:d5:cc:2f$68:ff:7b:9c:eb:36$192.168.0.105$172.217.166.42$6$52$0$35548$443$35548 → 443 [ACK] Seq=1 Ack=1 Win=501 Len=0 TSval=1185243424 TSecr=2000019272
3$Mar 28, 2020 23:37:41.585456636 IST$105$68:ff:7b:9c:eb:36$98:22:ef:d5:cc:2f$172.217.166.42$192.168.0.105$6$91$39$443$35548$[TCP Previous segment not captured] , Application Data
4$Mar 28, 2020 23:37:41.585511309 IST$78$98:22:ef:d5:cc:2f$68:ff:7b:9c:eb:36$192.168.0.105$172.217.166.42$6$64$0$35548$443$[TCP Dup ACK 2#1] 35548 → 443 [ACK] Seq=1 Ack=1 Win=501 Len=0 TSval=1185243686 TSecr=2000019272 SLE=1035 SRE=1074
5$Mar 28, 2020 23:37:41.587672667 IST$496$68:ff:7b:9c:eb:36$98:22:ef:d5:cc:2f$172.217.194.189$192.168.0.105$6$482$430$443$57806$Application Data
6$Mar 28, 2020 23:37:41.587704601 IST$66$98:22:ef:d5:cc:2f$68:ff:7b:9c:eb:36$192.168.0.105$172.217.194.189$6$52$0$57806$443$57806 → 443 [ACK] Seq=1 Ack=431 Win=1410 Len=0 TSval=1502247144 TSecr=1669116412
7$Mar 28, 2020 23:37:41.590031508 IST$722$68:ff:7b:9c:eb:36$98:22:ef:d5:cc:2f$172.217.166.42$192.168.0.105$6$708$656$443$35548$[TCP Retransmission] 443 → 35548 [PSH, ACK] Seq=1 Ack=1 Win=261 Len=656 TSval=2000019551 TSecr=1185243424
8$Mar 28, 2020 23:37:41.590076692 IST$78$98:22:ef:d5:cc:2f$68:ff:7b:9c:eb:36$192.168.0.105$172.217.166.42$6$64$0$35548$443$35548 → 443 [ACK] Seq=1 Ack=657 Win=496 Len=0 TSval=1185243690 TSecr=2000019551 SLE=1035 SRE=1074
9$Mar 28, 2020 23:37:41.590094376 IST$245$68:ff:7b:9c:eb:36$98:22:ef:d5:cc:2f$172.217.166.42$192.168.0.105$6$231$179$443$35548$[TCP Retransmission] 443 → 35548 [PSH, ACK] Seq=657 Ack=1 Win=261 Len=179 TSval=2000019551 TSecr=1185243424
10$Mar 28, 2020 23:37:41.590108751 IST$78$98:22:ef:d5:cc:2f$68:ff:7b:9c:eb:36$192.168.0.105$172.217.166.42$6$64$0$35548$443$35548 → 443 [ACK] Seq=1 Ack=836 Win=495 Len=0 TSval=1185243691 TSecr=2000019551 SLE=1035 SRE=1074
11$Mar 28, 2020 23:37:41.590116878 IST$265$68:ff:7b:9c:eb:36$98:22:ef:d5:cc:2f$172.217.166.42$192.168.0.105$6$251$199$443$35548$[TCP Retransmission] 443 → 35548 [PSH, ACK] Seq=836 Ack=1 Win=261 Len=199 TSval=2000019551 TSecr=1185243424
12$Mar 28, 2020 23:37:41.590129174 IST$66$98:22:ef:d5:cc:2f$68:ff:7b:9c:eb:36$192.168.0.105$172.217.166.42$6$52$0$35548$443$35548 → 443 [ACK] Seq=1 Ack=1074 Win=501 Len=0 TSval=1185243691 TSecr=2000019551
13$Mar 28, 2020 23:37:41.590769967 IST$105$98:22:ef:d5:cc:2f$68:ff:7b:9c:eb:36$192.168.0.105$172.217.166.42$6$91$39$35548$443$Application Data
14$Mar 28, 2020 23:37:41.604369423 IST$66$68:ff:7b:9c:eb:36$98:22:ef:d5:cc:2f$172.217.166.42$192.168.0.105$6$52$0$443$35548$443 → 35548 [ACK] Seq=1074 Ack=40 Win=261 Len=0 TSval=2000019597 TSecr=1185243691
15$Mar 28, 2020 23:37:42.326842324 IST$86$98:22:ef:d5:cc:2f$68:ff:7b:9c:eb:36$192.168.0.105$192.168.0.1$17$72$$$$Standard query 0x57ee A play.google.com OPT
16$Mar 28, 2020 23:37:42.329651704 IST$86$98:22:ef:d5:cc:2f$68:ff:7b:9c:eb:36$192.168.0.105$192.168.0.1$17$72$$$$Standard query 0xa4b5 AAAA play.google.com OPT
17$Mar 28, 2020 23:37:42.343771768 IST$114$68:ff:7b:9c:eb:36$98:22:ef:d5:cc:2f$192.168.0.1$192.168.0.105$17$100$$$$Standard query response 0xa4b5 AAAA play.google.com AAAA 2404:6800:4009:800::200e OPT
18$Mar 28, 2020 23:37:42.344128177 IST$102$68:ff:7b:9c:eb:36$98:22:ef:d5:cc:2f$192.168.0.1$192.168.0.105$17$88$$$$Standard query response 0x57ee A play.google.com A 172.217.27.206 OPT
19$Mar 28, 2020 23:37:42.360634110 IST$74$98:22:ef:d5:cc:2f$68:ff:7b:9c:eb:36$192.168.0.105$172.217.27.206$6$60$0$41618$443$41618 → 443 [SYN] Seq=0 Win=64240 Len=0 MSS=1460 SACK_PERM=1 TSval=675130569 TSecr=0 WS=128
20$Mar 28, 2020 23:37:42.377729126 IST$74$68:ff:7b:9c:eb:36$98:22:ef:d5:cc:2f$172.217.27.206$192.168.0.105$6$60$0$443$41618$443 → 41618 [SYN, ACK] Seq=0 Ack=1 Win=60192 Len=0 MSS=1380 SACK_PERM=1 TSval=1306073864 TSecr=675130569 WS=256
21$Mar 28, 2020 23:37:42.377789392 IST$66$98:22:ef:d5:cc:2f$68:ff:7b:9c:eb:36$192.168.0.105$172.217.27.206$6$52$0$41618$443$41618 → 443 [ACK] Seq=1 Ack=1 Win=64256 Len=0 TSval=675130586 TSecr=1306073864
22$Mar 28, 2020 23:37:42.380790520 IST$705$98:22:ef:d5:cc:2f$68:ff:7b:9c:eb:36$192.168.0.105$172.217.27.206$6$691$639$41618$443$Client Hello
23$Mar 28, 2020 23:37:42.402168036 IST$66$68:ff:7b:9c:eb:36$98:22:ef:d5:cc:2f$172.217.27.206$192.168.0.105$6$52$0$443$41618$443 → 41618 [ACK] Seq=1 Ack=640 Win=61696 Len=0 TSval=1306073886 TSecr=675130589
24$Mar 28, 2020 23:37:42.402201661 IST$278$68:ff:7b:9c:eb:36$98:22:ef:d5:cc:2f$172.217.27.206$192.168.0.105$6$264$212$443$41618$Server Hello, Change Cipher Spec, Application Data
25$Mar 28, 2020 23:37:42.402221174 IST$66$98:22:ef:d5:cc:2f$68:ff:7b:9c:eb:36$192.168.0.105$172.217.27.206$6$52$0$41618$443$41618 → 443 [ACK] Seq=640 Ack=213 Win=64128 Len=0 TSval=675130611 TSecr=1306073887
26$Mar 28, 2020 23:37:42.403333729 IST$130$98:22:ef:d5:cc:2f$68:ff:7b:9c:eb:36$192.168.0.105$172.217.27.206$6$116$64$41618$443$Change Cipher Spec, Application Data
27$Mar 28, 2020 23:37:42.406701560 IST$236$98:22:ef:d5:cc:2f$68:ff:7b:9c:eb:36$192.168.0.105$172.217.27.206$6$222$170$41618$443$Application Data
28$Mar 28, 2020 23:37:42.406783310 IST$1434$98:22:ef:d5:cc:2f$68:ff:7b:9c:eb:36$192.168.0.105$172.217.27.206$6$1420$1368$41618$443$Application Data
29$Mar 28, 2020 23:37:42.408251636 IST$684$98:22:ef:d5:cc:2f$68:ff:7b:9c:eb:36$192.168.0.105$172.217.27.206$6$670$618$41618$443$Application Data
30$Mar 28, 2020 23:37:42.419611735 IST$646$68:ff:7b:9c:eb:36$98:22:ef:d5:cc:2f$172.217.27.206$192.168.0.105$6$632$580$443$41618$Application Data, Application Data
31$Mar 28, 2020 23:37:42.419936712 IST$97$98:22:ef:d5:cc:2f$68:ff:7b:9c:eb:36$192.168.0.105$172.217.27.206$6$83$31$41618$443$Application Data
32$Mar 28, 2020 23:37:42.423601318 IST$66$68:ff:7b:9c:eb:36$98:22:ef:d5:cc:2f$172.217.27.206$192.168.0.105$6$52$0$443$41618$443 → 41618 [ACK] Seq=793 Ack=2242 Win=65536 Len=0 TSval=1306073910 TSecr=675130615
33$Mar 28, 2020 23:37:42.423855064 IST$97$68:ff:7b:9c:eb:36$98:22:ef:d5:cc:2f$172.217.27.206$192.168.0.105$6$83$31$443$41618$Application Data
34$Mar 28, 2020 23:37:42.438252370 IST$66$68:ff:7b:9c:eb:36$98:22:ef:d5:cc:2f$172.217.27.206$192.168.0.105$6$52$0$443$41618$443 → 41618 [ACK] Seq=824 Ack=2860 Win=68352 Len=0 TSval=1306073924 TSecr=675130617
35$Mar 28, 2020 23:37:42.441841932 IST$66$68:ff:7b:9c:eb:36$98:22:ef:d5:cc:2f$172.217.27.206$192.168.0.105$6$52$0$443$41618$443 → 41618 [ACK] Seq=824 Ack=2891 Win=68352 Len=0 TSval=1306073928 TSecr=675130628
36$Mar 28, 2020 23:37:42.467755314 IST$66$98:22:ef:d5:cc:2f$68:ff:7b:9c:eb:36$192.168.0.105$172.217.27.206$6$52$0$41618$443$41618 → 443 [ACK] Seq=2891 Ack=824 Win=64128 Len=0 TSval=675130676 TSecr=1306073910
37$Mar 28, 2020 23:37:42.498640312 IST$617$68:ff:7b:9c:eb:36$98:22:ef:d5:cc:2f$172.217.27.206$192.168.0.105$6$603$551$443$41618$Application Data
38$Mar 28, 2020 23:37:42.498674162 IST$66$98:22:ef:d5:cc:2f$68:ff:7b:9c:eb:36$192.168.0.105$172.217.27.206$6$52$0$41618$443$41618 → 443 [ACK] Seq=2891 Ack=1375 Win=64128 Len=0 TSval=675130707 TSecr=1306073984
39$Mar 28, 2020 23:37:42.498979191 IST$531$68:ff:7b:9c:eb:36$98:22:ef:d5:cc:2f$172.217.27.206$192.168.0.105$6$517$465$443$41618$Application Data, Application Data
40$Mar 28, 2020 23:37:42.498997244 IST$66$98:22:ef:d5:cc:2f$68:ff:7b:9c:eb:36$192.168.0.105$172.217.27.206$6$52$0$41618$443$41618 → 443 [ACK] Seq=2891 Ack=1840 Win=64128 Len=0 TSval=675130707 TSecr=1306073984
41$Mar 28, 2020 23:37:42.499005926 IST$105$68:ff:7b:9c:eb:36$98:22:ef:d5:cc:2f$172.217.27.206$192.168.0.105$6$91$39$443$41618$Application Data
42$Mar 28, 2020 23:37:42.499015353 IST$66$98:22:ef:d5:cc:2f$68:ff:7b:9c:eb:36$192.168.0.105$172.217.27.206$6$52$0$41618$443$41618 → 443 [ACK] Seq=2891 Ack=1879 Win=64128 Len=0 TSval=675130707 TSecr=1306073984
43$Mar 28, 2020 23:37:42.499192497 IST$105$98:22:ef:d5:cc:2f$68:ff:7b:9c:eb:36$192.168.0.105$172.217.27.206$6$91$39$41618$443$Application Data
44$Mar 28, 2020 23:37:42.517683323 IST$66$68:ff:7b:9c:eb:36$98:22:ef:d5:cc:2f$172.217.27.206$192.168.0.105$6$52$0$443$41618$443 → 41618 [ACK] Seq=1879 Ack=2930 Win=68352 Len=0 TSval=1306074003 TSecr=675130708
45$Mar 28, 2020 23:37:47.939074536 IST$42$68:ff:7b:9c:eb:36$98:22:ef:d5:cc:2f$$$$$$$$Who has 192.168.0.105? Tell 192.168.0.1
46$Mar 28, 2020 23:37:47.939093982 IST$42$98:22:ef:d5:cc:2f$68:ff:7b:9c:eb:36$$$$$$$$192.168.0.105 is at 98:22:ef:d5:cc:2f
47$Mar 28, 2020 23:37:48.248053683 IST$66$68:ff:7b:9c:eb:36$98:22:ef:d5:cc:2f$51.83.238.209$192.168.0.105$6$52$0$80$44335$80 → 44335 [ACK] Seq=1 Ack=1 Win=501 Len=0 TSval=1463510666 TSecr=2555269896
48$Mar 28, 2020 23:37:48.248088106 IST$66$98:22:ef:d5:cc:2f$68:ff:7b:9c:eb:36$192.168.0.105$51.83.238.209$6$52$0$44335$80$[TCP ACKed unseen segment] 44335 → 80 [ACK] Seq=1 Ack=2 Win=501 Len=0 TSval=2555280139 TSecr=1463486281
49$Mar 28, 2020 23:37:48.361114804 IST$105$98:22:ef:d5:cc:2f$68:ff:7b:9c:eb:36$192.168.0.105$216.58.203.163$6$91$39$56780$443$Application Data
50$Mar 28, 2020 23:37:48.427996341 IST$105$68:ff:7b:9c:eb:36$98:22:ef:d5:cc:2f$216.58.203.163$192.168.0.105$6$91$39$443$56780$Application Data
51$Mar 28, 2020 23:37:48.428070055 IST$66$98:22:ef:d5:cc:2f$68:ff:7b:9c:eb:36$192.168.0.105$216.58.203.163$6$52$0$56780$443$56780 → 443 [ACK] Seq=40 Ack=40 Win=2332 Len=0 TSval=2813440880 TSecr=1276914643
52$Mar 28, 2020 23:37:49.875372974 IST$74$98:22:ef:d5:cc:2f$68:ff:7b:9c:eb:36$192.168.0.105$111.221.29.254$6$60$0$52002$443$52002 → 443 [SYN] Seq=0 Win=64240 Len=0 MSS=1460 SACK_PERM=1 TSval=1391556948 TSecr=0 WS=128
53$Mar 28, 2020 23:37:49.984084138 IST$74$68:ff:7b:9c:eb:36$98:22:ef:d5:cc:2f$111.221.29.254$192.168.0.105$6$60$0$443$52002$443 → 52002 [SYN, ACK] Seq=0 Ack=1 Win=8192 Len=0 MSS=1440 WS=256 SACK_PERM=1 TSval=878705799 TSecr=1391556948
54$Mar 28, 2020 23:37:49.984135734 IST$66$98:22:ef:d5:cc:2f$68:ff:7b:9c:eb:36$192.168.0.105$111.221.29.254$6$52$0$52002$443$52002 → 443 [ACK] Seq=1 Ack=1 Win=64256 Len=0 TSval=1391557057 TSecr=878705799
55$Mar 28, 2020 23:37:49.984471958 IST$583$98:22:ef:d5:cc:2f$68:ff:7b:9c:eb:36$192.168.0.105$111.221.29.254$6$569$517$52002$443$Client Hello
56$Mar 28, 2020 23:37:50.090729866 IST$1514$68:ff:7b:9c:eb:36$98:22:ef:d5:cc:2f$111.221.29.254$192.168.0.105$6$1500$1448$443$52002$[TCP segment of a reassembled PDU]
57$Mar 28, 2020 23:37:50.090773575 IST$66$98:22:ef:d5:cc:2f$68:ff:7b:9c:eb:36$192.168.0.105$111.221.29.254$6$52$0$52002$443$52002 → 443 [ACK] Seq=518 Ack=1449 Win=64128 Len=0 TSval=1391557163 TSecr=878705895
58$Mar 28, 2020 23:37:50.091036537 IST$1514$68:ff:7b:9c:eb:36$98:22:ef:d5:cc:2f$111.221.29.254$192.168.0.105$6$1500$1448$443$52002$443 → 52002 [ACK] Seq=1449 Ack=518 Win=263424 Len=1448 TSval=878705895 TSecr=1391557057 [TCP segment of a reassembled PDU]
59$Mar 28, 2020 23:37:50.091054600 IST$66$98:22:ef:d5:cc:2f$68:ff:7b:9c:eb:36$192.168.0.105$111.221.29.254$6$52$0$52002$443$52002 → 443 [ACK] Seq=518 Ack=2897 Win=64128 Len=0 TSval=1391557164 TSecr=878705895
60$Mar 28, 2020 23:37:50.091280174 IST$1195$68:ff:7b:9c:eb:36$98:22:ef:d5:cc:2f$111.221.29.254$192.168.0.105$6$1181$1129$443$52002$Server Hello, Certificate, Server Key Exchange, Server Hello Done
61$Mar 28, 2020 23:37:50.091296372 IST$66$98:22:ef:d5:cc:2f$68:ff:7b:9c:eb:36$192.168.0.105$111.221.29.254$6$52$0$52002$443$52002 → 443 [ACK] Seq=518 Ack=4026 Win=64128 Len=0 TSval=1391557164 TSecr=878705895
62$Mar 28, 2020 23:37:50.092299750 IST$159$98:22:ef:d5:cc:2f$68:ff:7b:9c:eb:36$192.168.0.105$111.221.29.254$6$145$93$52002$443$Client Key Exchange, Change Cipher Spec, Encrypted Handshake Message
63$Mar 28, 2020 23:37:50.293426074 IST$117$68:ff:7b:9c:eb:36$98:22:ef:d5:cc:2f$111.221.29.254$192.168.0.105$6$103$51$443$52002$Change Cipher Spec, Encrypted Handshake Message
64$Mar 28, 2020 23:37:50.295552476 IST$1148$98:22:ef:d5:cc:2f$68:ff:7b:9c:eb:36$192.168.0.105$111.221.29.254$6$1134$1082$52002$443$Application Data
65$Mar 28, 2020 23:37:50.390114419 IST$42$68:ff:7b:9c:eb:36$ff:ff:ff:ff:ff:ff$$$$$$$$Who has 192.168.0.101? Tell 192.168.0.1
66$Mar 28, 2020 23:37:50.498210484 IST$380$68:ff:7b:9c:eb:36$98:22:ef:d5:cc:2f$111.221.29.254$192.168.0.105$6$366$314$443$52002$Application Data
67$Mar 28, 2020 23:37:50.498775386 IST$97$98:22:ef:d5:cc:2f$68:ff:7b:9c:eb:36$192.168.0.105$111.221.29.254$6$83$31$52002$443$Encrypted Alert
68$Mar 28, 2020 23:37:50.500295074 IST$66$98:22:ef:d5:cc:2f$68:ff:7b:9c:eb:36$192.168.0.105$111.221.29.254$6$52$0$52002$443$52002 → 443 [FIN, ACK] Seq=1724 Ack=4392 Win=64128 Len=0 TSval=1391557573 TSecr=878706263
69$Mar 28, 2020 23:37:50.598591461 IST$66$68:ff:7b:9c:eb:36$98:22:ef:d5:cc:2f$111.221.29.254$192.168.0.105$6$52$0$443$52002$[TCP Dup ACK 66#1] 443 → 52002 [ACK] Seq=4392 Ack=1693 Win=262144 Len=0 TSval=878706413 TSecr=1391557368
70$Mar 28, 2020 23:37:50.603036246 IST$66$68:ff:7b:9c:eb:36$98:22:ef:d5:cc:2f$111.221.29.254$192.168.0.105$6$52$0$443$52002$443 → 52002 [ACK] Seq=4392 Ack=1725 Win=262144 Len=0 TSval=878706418 TSecr=1391557571
71$Mar 28, 2020 23:37:51.622788097 IST$100$68:ff:7b:9c:eb:36$98:22:ef:d5:cc:2f$35.173.69.207$192.168.0.105$6$86$34$443$39398$Application Data
72$Mar 28, 2020 23:37:51.622820664 IST$66$98:22:ef:d5:cc:2f$68:ff:7b:9c:eb:36$192.168.0.105$35.173.69.207$6$52$0$39398$443$39398 → 443 [ACK] Seq=1 Ack=35 Win=501 Len=0 TSval=3819620467 TSecr=522167871
73$Mar 28, 2020 23:37:52.033340394 IST$100$68:ff:7b:9c:eb:36$98:22:ef:d5:cc:2f$35.173.69.207$192.168.0.105$6$86$34$443$39402$Application Data
74$Mar 28, 2020 23:37:52.033381224 IST$66$98:22:ef:d5:cc:2f$68:ff:7b:9c:eb:36$192.168.0.105$35.173.69.207$6$52$0$39402$443$39402 → 443 [ACK] Seq=1 Ack=35 Win=501 Len=0 TSval=3819620877 TSecr=522167958
75$Mar 28, 2020 23:37:52.332054488 IST$86$98:22:ef:d5:cc:2f$68:ff:7b:9c:eb:36$192.168.0.105$192.168.0.1$17$72$$$$Standard query 0x360c AAAA ssl.gstatic.com OPT
76$Mar 28, 2020 23:37:52.336508641 IST$165$98:22:ef:d5:cc:2f$68:ff:7b:9c:eb:36$192.168.0.105$216.58.203.163$6$151$99$56780$443$Application Data
77$Mar 28, 2020 23:37:52.344584089 IST$114$68:ff:7b:9c:eb:36$98:22:ef:d5:cc:2f$192.168.0.1$192.168.0.105$17$100$$$$Standard query response 0x360c AAAA ssl.gstatic.com AAAA 2404:6800:4009:803::2003 OPT
78$Mar 28, 2020 23:37:52.358598611 IST$66$68:ff:7b:9c:eb:36$98:22:ef:d5:cc:2f$216.58.203.163$192.168.0.105$6$52$0$443$56780$443 → 56780 [ACK] Seq=40 Ack=139 Win=266 Len=0 TSval=1276918626 TSecr=2813444788
79$Mar 28, 2020 23:37:52.408565712 IST$42$68:ff:7b:9c:eb:36$ff:ff:ff:ff:ff:ff$$$$$$$$Who has 192.168.0.101? Tell 192.168.0.1
80$Mar 28, 2020 23:37:52.414196998 IST$143$68:ff:7b:9c:eb:36$98:22:ef:d5:cc:2f$216.58.203.163$192.168.0.105$6$129$77$443$56780$Application Data
81$Mar 28, 2020 23:37:52.414240024 IST$66$98:22:ef:d5:cc:2f$68:ff:7b:9c:eb:36$192.168.0.105$216.58.203.163$6$52$0$56780$443$56780 → 443 [ACK] Seq=139 Ack=117 Win=2332 Len=0 TSval=2813444866 TSecr=1276918682
82$Mar 28, 2020 23:37:52.414297866 IST$140$68:ff:7b:9c:eb:36$98:22:ef:d5:cc:2f$216.58.203.163$192.168.0.105$6$126$74$443$56780$Application Data
83$Mar 28, 2020 23:37:52.414308923 IST$66$98:22:ef:d5:cc:2f$68:ff:7b:9c:eb:36$192.168.0.105$216.58.203.163$6$52$0$56780$443$56780 → 443 [ACK] Seq=139 Ack=191 Win=2332 Len=0 TSval=2813444866 TSecr=1276918682
84$Mar 28, 2020 23:37:52.415175628 IST$97$68:ff:7b:9c:eb:36$98:22:ef:d5:cc:2f$216.58.203.163$192.168.0.105$6$83$31$443$56780$Application Data
85$Mar 28, 2020 23:37:52.415214607 IST$66$98:22:ef:d5:cc:2f$68:ff:7b:9c:eb:36$192.168.0.105$216.58.203.163$6$52$0$56780$443$56780 → 443 [ACK] Seq=139 Ack=222 Win=2332 Len=0 TSval=2813444867 TSecr=1276918683
86$Mar 28, 2020 23:37:52.415270811 IST$105$68:ff:7b:9c:eb:36$98:22:ef:d5:cc:2f$216.58.203.163$192.168.0.105$6$91$39$443$56780$Application Data
87$Mar 28, 2020 23:37:52.415284757 IST$66$98:22:ef:d5:cc:2f$68:ff:7b:9c:eb:36$192.168.0.105$216.58.203.163$6$52$0$56780$443$56780 → 443 [ACK] Seq=139 Ack=261 Win=2332 Len=0 TSval=2813444867 TSecr=1276918683
88$Mar 28, 2020 23:37:52.415467132 IST$105$98:22:ef:d5:cc:2f$68:ff:7b:9c:eb:36$192.168.0.105$216.58.203.163$6$91$39$56780$443$Application Data
89$Mar 28, 2020 23:37:52.431200862 IST$66$68:ff:7b:9c:eb:36$98:22:ef:d5:cc:2f$216.58.203.163$192.168.0.105$6$52$0$443$56780$443 → 56780 [ACK] Seq=261 Ack=178 Win=266 Len=0 TSval=1276918698 TSecr=2813444867
90$Mar 28, 2020 23:37:58.485711616 IST$66$68:ff:7b:9c:eb:36$98:22:ef:d5:cc:2f$51.83.238.209$192.168.0.105$6$52$0$80$44335$[TCP Dup ACK 47#1] 80 → 44335 [ACK] Seq=1 Ack=1 Win=501 Len=0 TSval=1463520906 TSecr=2555280139
91$Mar 28, 2020 23:37:58.485750297 IST$66$98:22:ef:d5:cc:2f$68:ff:7b:9c:eb:36$192.168.0.105$51.83.238.209$6$52$0$44335$80$[TCP Dup ACK 48#1] [TCP ACKed unseen segment] 44335 → 80 [ACK] Seq=1 Ack=2 Win=501 Len=0 TSval=2555290377 TSecr=1463486281
92$Mar 28, 2020 23:38:03.906863165 IST$82$30:4b:07:69:03:c0$ff:ff:ff:ff:ff:ff$192.168.0.103$255.255.255.255$17$68$$$$57621 → 57621 Len=40
93$Mar 28, 2020 23:38:04.724195861 IST$91$98:22:ef:d5:cc:2f$68:ff:7b:9c:eb:36$192.168.0.105$192.168.0.1$17$77$$$$Standard query 0x650c A fonts.googleapis.com OPT
94$Mar 28, 2020 23:38:04.726908662 IST$91$98:22:ef:d5:cc:2f$68:ff:7b:9c:eb:36$192.168.0.105$192.168.0.1$17$77$$$$Standard query 0x41e7 AAAA fonts.googleapis.com OPT
95$Mar 28, 2020 23:38:04.737609531 IST$107$68:ff:7b:9c:eb:36$98:22:ef:d5:cc:2f$192.168.0.1$192.168.0.105$17$93$$$$Standard query response 0x650c A fonts.googleapis.com A 172.217.166.74 OPT
96$Mar 28, 2020 23:38:04.746146298 IST$119$68:ff:7b:9c:eb:36$98:22:ef:d5:cc:2f$192.168.0.1$192.168.0.105$17$105$$$$Standard query response 0x41e7 AAAA fonts.googleapis.com AAAA 2404:6800:4009:80d::200a OPT
97$Mar 28, 2020 23:38:05.058745668 IST$108$98:22:ef:d5:cc:2f$68:ff:7b:9c:eb:36$192.168.0.105$192.168.0.1$17$94$$$$Standard query 0x5f22 A firefox.settings.services.mozilla.com OPT
98$Mar 28, 2020 23:38:05.061298795 IST$74$98:22:ef:d5:cc:2f$68:ff:7b:9c:eb:36$192.168.0.105$172.217.166.74$6$60$0$48330$443$48330 → 443 [SYN] Seq=0 Win=64240 Len=0 MSS=1460 SACK_PERM=1 TSval=1225159727 TSecr=0 WS=128
99$Mar 28, 2020 23:38:05.061632729 IST$108$98:22:ef:d5:cc:2f$68:ff:7b:9c:eb:36$192.168.0.105$192.168.0.1$17$94$$$$Standard query 0x59d4 AAAA firefox.settings.services.mozilla.com OPT
100$Mar 28, 2020 23:38:05.071844847 IST$375$68:ff:7b:9c:eb:36$98:22:ef:d5:cc:2f$192.168.0.1$192.168.0.105$17$361$$$$Standard query response 0x59d4 AAAA firefox.settings.services.mozilla.com CNAME d2k03kvdk5cku0.cloudfront.net AAAA 2600:9000:21f6:f400:16:eede:5e00:93a1 AAAA 2600:9000:21f6:de00:16:eede:5e00:93a1 AAAA 2600:9000:21f6:d200:16:eede:5e00:93a1 AAAA 2600:9000:21f6:7200:16:eede:5e00:93a1 AAAA 2600:9000:21f6:0:16:eede:5e00:93a1 AAAA 2600:9000:21f6:d800:16:eede:5e00:93a1 AAAA 2600:9000:21f6:cc00:16:eede:5e00:93a1 AAAA 2600:9000:21f6:b800:16:eede:5e00:93a1 OPT
101$Mar 28, 2020 23:38:05.071995393 IST$215$68:ff:7b:9c:eb:36$98:22:ef:d5:cc:2f$192.168.0.1$192.168.0.105$17$201$$$$Standard query response 0x5f22 A firefox.settings.services.mozilla.com CNAME d2k03kvdk5cku0.cloudfront.net A 13.227.185.101 A 13.227.185.10 A 13.227.185.100 A 13.227.185.90 OPT
102$Mar 28, 2020 23:38:05.073137196 IST$74$98:22:ef:d5:cc:2f$68:ff:7b:9c:eb:36$192.168.0.105$13.227.185.90$6$60$0$57996$443$57996 → 443 [SYN] Seq=0 Win=64240 Len=0 MSS=1460 SACK_PERM=1 TSval=1151111320 TSecr=0 WS=128
103$Mar 28, 2020 23:38:05.074668000 IST$74$68:ff:7b:9c:eb:36$98:22:ef:d5:cc:2f$172.217.166.74$192.168.0.105$6$60$0$443$48330$443 → 48330 [SYN, ACK] Seq=0 Ack=1 Win=60192 Len=0 MSS=1380 SACK_PERM=1 TSval=586853335 TSecr=1225159727 WS=256
104$Mar 28, 2020 23:38:05.074699065 IST$66$98:22:ef:d5:cc:2f$68:ff:7b:9c:eb:36$192.168.0.105$172.217.166.74$6$52$0$48330$443$48330 → 443 [ACK] Seq=1 Ack=1 Win=64256 Len=0 TSval=1225159742 TSecr=586853335
105$Mar 28, 2020 23:38:05.076502728 IST$710$98:22:ef:d5:cc:2f$68:ff:7b:9c:eb:36$192.168.0.105$172.217.166.74$6$696$644$48330$443$Client Hello
106$Mar 28, 2020 23:38:05.079517014 IST$66$98:22:ef:d5:cc:2f$68:ff:7b:9c:eb:36$192.168.0.105$172.217.166.74$6$52$0$48330$443$48330 → 443 [FIN, ACK] Seq=645 Ack=1 Win=64256 Len=0 TSval=1225159747 TSecr=586853335
107$Mar 28, 2020 23:38:05.090584401 IST$78$68:ff:7b:9c:eb:36$98:22:ef:d5:cc:2f$172.217.166.74$192.168.0.105$6$64$0$443$48330$[TCP Window Update] 443 → 48330 [ACK] Seq=1 Ack=1 Win=60416 Len=0 TSval=586853351 TSecr=1225159742 SLE=645 SRE=646
108$Mar 28, 2020 23:38:05.090634476 IST$710$98:22:ef:d5:cc:2f$68:ff:7b:9c:eb:36$192.168.0.105$172.217.166.74$6$696$644$48330$443$[TCP Out-Of-Order] 48330 → 443 [PSH, ACK] Seq=1 Ack=1 Win=64256 Len=644 TSval=1225159758 TSecr=586853351
109$Mar 28, 2020 23:38:05.090753092 IST$74$68:ff:7b:9c:eb:36$98:22:ef:d5:cc:2f$13.227.185.90$192.168.0.105$6$60$0$443$57996$443 → 57996 [SYN, ACK] Seq=0 Ack=1 Win=28960 Len=0 MSS=1460 SACK_PERM=1 TSval=126751174 TSecr=1151111320 WS=256
110$Mar 28, 2020 23:38:05.090787026 IST$66$98:22:ef:d5:cc:2f$68:ff:7b:9c:eb:36$192.168.0.105$13.227.185.90$6$52$0$57996$443$57996 → 443 [ACK] Seq=1 Ack=1 Win=64256 Len=0 TSval=1151111338 TSecr=126751174
111$Mar 28, 2020 23:38:05.093546016 IST$583$98:22:ef:d5:cc:2f$68:ff:7b:9c:eb:36$192.168.0.105$13.227.185.90$6$569$517$57996$443$Client Hello
112$Mar 28, 2020 23:38:05.098235950 IST$66$68:ff:7b:9c:eb:36$98:22:ef:d5:cc:2f$172.217.166.74$192.168.0.105$6$52$0$443$48330$443 → 48330 [ACK] Seq=1 Ack=646 Win=61696 Len=0 TSval=586853358 TSecr=1225159744
113$Mar 28, 2020 23:38:05.098320217 IST$278$68:ff:7b:9c:eb:36$98:22:ef:d5:cc:2f$172.217.166.74$192.168.0.105$6$264$212$443$48330$Server Hello, Change Cipher Spec, Application Data
114$Mar 28, 2020 23:38:05.098342682 IST$54$98:22:ef:d5:cc:2f$68:ff:7b:9c:eb:36$192.168.0.105$172.217.166.74$6$40$0$48330$443$48330 → 443 [RST] Seq=646 Win=0 Len=0
115$Mar 28, 2020 23:38:05.098355076 IST$66$68:ff:7b:9c:eb:36$98:22:ef:d5:cc:2f$172.217.166.74$192.168.0.105$6$52$0$443$48330$443 → 48330 [FIN, ACK] Seq=213 Ack=646 Win=61696 Len=0 TSval=586853359 TSecr=1225159744
116$Mar 28, 2020 23:38:05.098362275 IST$54$98:22:ef:d5:cc:2f$68:ff:7b:9c:eb:36$192.168.0.105$172.217.166.74$6$40$0$48330$443$48330 → 443 [RST] Seq=646 Win=0 Len=0
117$Mar 28, 2020 23:38:05.108952550 IST$78$68:ff:7b:9c:eb:36$98:22:ef:d5:cc:2f$172.217.166.74$192.168.0.105$6$64$0$443$48330$[TCP Dup ACK 112#1] 443 → 48330 [ACK] Seq=214 Ack=646 Win=61696 Len=0 TSval=586853369 TSecr=1225159744 SLE=1 SRE=645
118$Mar 28, 2020 23:38:05.108990802 IST$54$98:22:ef:d5:cc:2f$68:ff:7b:9c:eb:36$192.168.0.105$172.217.166.74$6$40$0$48330$443$48330 → 443 [RST] Seq=646 Win=0 Len=0
119$Mar 28, 2020 23:38:05.113706341 IST$66$68:ff:7b:9c:eb:36$98:22:ef:d5:cc:2f$13.227.185.90$192.168.0.105$6$52$0$443$57996$443 → 57996 [ACK] Seq=1 Ack=518 Win=30208 Len=0 TSval=126751177 TSecr=1151111341
120$Mar 28, 2020 23:38:05.114755056 IST$213$68:ff:7b:9c:eb:36$98:22:ef:d5:cc:2f$13.227.185.90$192.168.0.105$6$199$147$443$57996$Server Hello, Change Cipher Spec, Encrypted Handshake Message
121$Mar 28, 2020 23:38:05.114774859 IST$66$98:22:ef:d5:cc:2f$68:ff:7b:9c:eb:36$192.168.0.105$13.227.185.90$6$52$0$57996$443$57996 → 443 [ACK] Seq=518 Ack=148 Win=64128 Len=0 TSval=1151111362 TSecr=126751177
122$Mar 28, 2020 23:38:05.115235685 IST$117$98:22:ef:d5:cc:2f$68:ff:7b:9c:eb:36$192.168.0.105$13.227.185.90$6$103$51$57996$443$Change Cipher Spec, Encrypted Handshake Message
123$Mar 28, 2020 23:38:05.117049281 IST$438$98:22:ef:d5:cc:2f$68:ff:7b:9c:eb:36$192.168.0.105$13.227.185.90$6$424$372$57996$443$Application Data
124$Mar 28, 2020 23:38:05.134357278 IST$66$68:ff:7b:9c:eb:36$98:22:ef:d5:cc:2f$13.227.185.90$192.168.0.105$6$52$0$443$57996$443 → 57996 [ACK] Seq=148 Ack=569 Win=30208 Len=0 TSval=126751178 TSecr=1151111362
125$Mar 28, 2020 23:38:05.138063271 IST$66$68:ff:7b:9c:eb:36$98:22:ef:d5:cc:2f$13.227.185.90$192.168.0.105$6$52$0$443$57996$443 → 57996 [ACK] Seq=148 Ack=941 Win=31232 Len=0 TSval=126751179 TSecr=1151111364
126$Mar 28, 2020 23:38:05.141356217 IST$889$68:ff:7b:9c:eb:36$98:22:ef:d5:cc:2f$13.227.185.90$192.168.0.105$6$875$823$443$57996$Application Data
127$Mar 28, 2020 23:38:05.145731178 IST$101$98:22:ef:d5:cc:2f$68:ff:7b:9c:eb:36$192.168.0.105$192.168.0.1$17$87$$$$Standard query 0x7704 A incoming.telemetry.mozilla.org OPT
128$Mar 28, 2020 23:38:05.145963070 IST$101$98:22:ef:d5:cc:2f$68:ff:7b:9c:eb:36$192.168.0.105$192.168.0.1$17$87$$$$Standard query 0x4f42 AAAA incoming.telemetry.mozilla.org OPT
129$Mar 28, 2020 23:38:05.158250362 IST$313$68:ff:7b:9c:eb:36$98:22:ef:d5:cc:2f$192.168.0.1$192.168.0.105$17$299$$$$Standard query response 0x4f42 AAAA incoming.telemetry.mozilla.org CNAME telemetry-incoming.r53-2.services.mozilla.com CNAME pipeline-incoming-prod-elb-149169523.us-west-2.elb.amazonaws.com SOA ns-332.awsdns-41.com OPT
130$Mar 28, 2020 23:38:05.158567184 IST$363$68:ff:7b:9c:eb:36$98:22:ef:d5:cc:2f$192.168.0.1$192.168.0.105$17$349$$$$Standard query response 0x7704 A incoming.telemetry.mozilla.org CNAME telemetry-incoming.r53-2.services.mozilla.com CNAME pipeline-incoming-prod-elb-149169523.us-west-2.elb.amazonaws.com A 34.212.193.45 A 52.10.174.113 A 52.88.91.154 A 52.36.109.157 A 52.88.148.130 A 52.88.126.42 A 35.163.133.164 A 52.35.6.89 OPT
131$Mar 28, 2020 23:38:05.158994845 IST$135$98:22:ef:d5:cc:2f$68:ff:7b:9c:eb:36$192.168.0.105$192.168.0.1$17$121$$$$Standard query 0x576c AAAA pipeline-incoming-prod-elb-149169523.us-west-2.elb.amazonaws.com OPT
132$Mar 28, 2020 23:38:05.174966285 IST$213$68:ff:7b:9c:eb:36$98:22:ef:d5:cc:2f$192.168.0.1$192.168.0.105$17$199$$$$Standard query response 0x576c AAAA pipeline-incoming-prod-elb-149169523.us-west-2.elb.amazonaws.com SOA ns-332.awsdns-41.com OPT
133$Mar 28, 2020 23:38:05.175688071 IST$74$98:22:ef:d5:cc:2f$68:ff:7b:9c:eb:36$192.168.0.105$52.88.91.154$6$60$0$58314$443$58314 → 443 [SYN] Seq=0 Win=64240 Len=0 MSS=1460 SACK_PERM=1 TSval=3612049698 TSecr=0 WS=128
134$Mar 28, 2020 23:38:05.183762402 IST$66$98:22:ef:d5:cc:2f$68:ff:7b:9c:eb:36$192.168.0.105$13.227.185.90$6$52$0$57996$443$57996 → 443 [ACK] Seq=941 Ack=971 Win=64128 Len=0 TSval=1151111431 TSecr=126751179
135$Mar 28, 2020 23:38:05.189266231 IST$465$98:22:ef:d5:cc:2f$68:ff:7b:9c:eb:36$192.168.0.105$13.227.185.90$6$451$399$57996$443$Application Data
136$Mar 28, 2020 23:38:05.205631163 IST$881$68:ff:7b:9c:eb:36$98:22:ef:d5:cc:2f$13.227.185.90$192.168.0.105$6$867$815$443$57996$Application Data
137$Mar 28, 2020 23:38:05.205686005 IST$66$98:22:ef:d5:cc:2f$68:ff:7b:9c:eb:36$192.168.0.105$13.227.185.90$6$52$0$57996$443$57996 → 443 [ACK] Seq=1340 Ack=1786 Win=64128 Len=0 TSval=1151111453 TSecr=126751186
138$Mar 28, 2020 23:38:05.205836093 IST$425$68:ff:7b:9c:eb:36$98:22:ef:d5:cc:2f$13.227.185.90$192.168.0.105$6$411$359$443$57996$Application Data
139$Mar 28, 2020 23:38:05.205854363 IST$66$98:22:ef:d5:cc:2f$68:ff:7b:9c:eb:36$192.168.0.105$13.227.185.90$6$52$0$57996$443$57996 → 443 [ACK] Seq=1340 Ack=2145 Win=64128 Len=0 TSval=1151111453 TSecr=126751186
140$Mar 28, 2020 23:38:05.426068252 IST$74$98:22:ef:d5:cc:2f$68:ff:7b:9c:eb:36$192.168.0.105$52.88.91.154$6$60$0$58318$443$58318 → 443 [SYN] Seq=0 Win=64240 Len=0 MSS=1460 SACK_PERM=1 TSval=3612049948 TSecr=0 WS=128
141$Mar 28, 2020 23:38:05.446753526 IST$74$68:ff:7b:9c:eb:36$98:22:ef:d5:cc:2f$52.88.91.154$192.168.0.105$6$60$0$443$58314$443 → 58314 [SYN, ACK] Seq=0 Ack=1 Win=26847 Len=0 MSS=1460 SACK_PERM=1 TSval=3375533787 TSecr=3612049698 WS=256
142$Mar 28, 2020 23:38:05.446806686 IST$66$98:22:ef:d5:cc:2f$68:ff:7b:9c:eb:36$192.168.0.105$52.88.91.154$6$52$0$58314$443$58314 → 443 [ACK] Seq=1 Ack=1 Win=64256 Len=0 TSval=3612049969 TSecr=3375533787
143$Mar 28, 2020 23:38:05.447060857 IST$311$98:22:ef:d5:cc:2f$68:ff:7b:9c:eb:36$192.168.0.105$52.88.91.154$6$297$245$58314$443$Client Hello
144$Mar 28, 2020 23:38:05.695985700 IST$465$98:22:ef:d5:cc:2f$68:ff:7b:9c:eb:36$192.168.0.105$13.227.185.90$6$451$399$57996$443$Application Data
145$Mar 28, 2020 23:38:05.702186952 IST$74$68:ff:7b:9c:eb:36$98:22:ef:d5:cc:2f$52.88.91.154$192.168.0.105$6$60$0$443$58318$443 → 58318 [SYN, ACK] Seq=0 Ack=1 Win=26847 Len=0 MSS=1460 SACK_PERM=1 TSval=3375534043 TSecr=3612049948 WS=256
146$Mar 28, 2020 23:38:05.702224075 IST$66$98:22:ef:d5:cc:2f$68:ff:7b:9c:eb:36$192.168.0.105$52.88.91.154$6$52$0$58318$443$58318 → 443 [ACK] Seq=1 Ack=1 Win=64256 Len=0 TSval=3612050224 TSecr=3375534043
147$Mar 28, 2020 23:38:05.702449992 IST$311$98:22:ef:d5:cc:2f$68:ff:7b:9c:eb:36$192.168.0.105$52.88.91.154$6$297$245$58318$443$Client Hello
148$Mar 28, 2020 23:38:05.714202774 IST$881$68:ff:7b:9c:eb:36$98:22:ef:d5:cc:2f$13.227.185.90$192.168.0.105$6$867$815$443$57996$Application Data
149$Mar 28, 2020 23:38:05.714247056 IST$66$98:22:ef:d5:cc:2f$68:ff:7b:9c:eb:36$192.168.0.105$13.227.185.90$6$52$0$57996$443$57996 → 443 [ACK] Seq=1739 Ack=2960 Win=64128 Len=0 TSval=1151111961 TSecr=126751237
150$Mar 28, 2020 23:38:05.714264004 IST$425$68:ff:7b:9c:eb:36$98:22:ef:d5:cc:2f$13.227.185.90$192.168.0.105$6$411$359$443$57996$Application Data
151$Mar 28, 2020 23:38:05.714278236 IST$66$98:22:ef:d5:cc:2f$68:ff:7b:9c:eb:36$192.168.0.105$13.227.185.90$6$52$0$57996$443$57996 → 443 [ACK] Seq=1739 Ack=3319 Win=64128 Len=0 TSval=1151111961 TSecr=126751237
152$Mar 28, 2020 23:38:05.716311623 IST$66$68:ff:7b:9c:eb:36$98:22:ef:d5:cc:2f$52.88.91.154$192.168.0.105$6$52$0$443$58314$443 → 58314 [ACK] Seq=1 Ack=246 Win=30464 Len=0 TSval=3375534103 TSecr=3612049969
153$Mar 28, 2020 23:38:05.717842767 IST$1514$68:ff:7b:9c:eb:36$98:22:ef:d5:cc:2f$52.88.91.154$192.168.0.105$6$1500$1448$443$58314$Server Hello
154$Mar 28, 2020 23:38:05.717874483 IST$66$98:22:ef:d5:cc:2f$68:ff:7b:9c:eb:36$192.168.0.105$52.88.91.154$6$52$0$58314$443$58314 → 443 [ACK] Seq=246 Ack=1449 Win=64128 Len=0 TSval=3612050240 TSecr=3375534104
155$Mar 28, 2020 23:38:05.718156279 IST$2021$68:ff:7b:9c:eb:36$98:22:ef:d5:cc:2f$52.88.91.154$192.168.0.105$6$2007$1955$443$58314$Certificate, Server Key Exchange, Server Hello Done
156$Mar 28, 2020 23:38:05.718173074 IST$66$98:22:ef:d5:cc:2f$68:ff:7b:9c:eb:36$192.168.0.105$52.88.91.154$6$52$0$58314$443$58314 → 443 [ACK] Seq=246 Ack=3404 Win=63104 Len=0 TSval=3612050240 TSecr=3375534104
157$Mar 28, 2020 23:38:05.725219792 IST$192$98:22:ef:d5:cc:2f$68:ff:7b:9c:eb:36$192.168.0.105$52.88.91.154$6$178$126$58314$443$Client Key Exchange, Change Cipher Spec, Encrypted Handshake Message
158$Mar 28, 2020 23:38:05.726741656 IST$748$98:22:ef:d5:cc:2f$68:ff:7b:9c:eb:36$192.168.0.105$52.88.91.154$6$734$682$58314$443$Application Data
159$Mar 28, 2020 23:38:05.732427279 IST$74$98:22:ef:d5:cc:2f$68:ff:7b:9c:eb:36$192.168.0.105$52.88.91.154$6$60$0$58322$443$58322 → 443 [SYN] Seq=0 Win=64240 Len=0 MSS=1460 SACK_PERM=1 TSval=3612050255 TSecr=0 WS=128
160$Mar 28, 2020 23:38:05.741547450 IST$547$98:22:ef:d5:cc:2f$68:ff:7b:9c:eb:36$192.168.0.105$13.227.185.90$6$533$481$57996$443$Application Data
161$Mar 28, 2020 23:38:05.760340214 IST$722$68:ff:7b:9c:eb:36$98:22:ef:d5:cc:2f$13.227.185.90$192.168.0.105$6$708$656$443$57996$Application Data
162$Mar 28, 2020 23:38:05.803764248 IST$66$98:22:ef:d5:cc:2f$68:ff:7b:9c:eb:36$192.168.0.105$13.227.185.90$6$52$0$57996$443$57996 → 443 [ACK] Seq=2220 Ack=3975 Win=64128 Len=0 TSval=1151112051 TSecr=126751241
163$Mar 28, 2020 23:38:05.982882873 IST$74$98:22:ef:d5:cc:2f$68:ff:7b:9c:eb:36$192.168.0.105$52.88.91.154$6$60$0$58324$443$58324 → 443 [SYN] Seq=0 Win=64240 Len=0 MSS=1460 SACK_PERM=1 TSval=3612050505 TSecr=0 WS=128
164$Mar 28, 2020 23:38:05.992338683 IST$100$98:22:ef:d5:cc:2f$68:ff:7b:9c:eb:36$192.168.0.105$192.168.0.1$17$86$$$$Standard query 0x4c73 A d1ykf07e75w7ss.cloudfront.net OPT
165$Mar 28, 2020 23:38:05.995603344 IST$66$68:ff:7b:9c:eb:36$98:22:ef:d5:cc:2f$52.88.91.154$192.168.0.105$6$52$0$443$58318$443 → 58318 [ACK] Seq=1 Ack=246 Win=30464 Len=0 TSval=3375534360 TSecr=3612050225
166$Mar 28, 2020 23:38:05.995637315 IST$3469$68:ff:7b:9c:eb:36$98:22:ef:d5:cc:2f$52.88.91.154$192.168.0.105$6$3455$3403$443$58318$Server Hello, Certificate, Server Key Exchange, Server Hello Done
167$Mar 28, 2020 23:38:05.995653984 IST$66$98:22:ef:d5:cc:2f$68:ff:7b:9c:eb:36$192.168.0.105$52.88.91.154$6$52$0$58318$443$58318 → 443 [ACK] Seq=246 Ack=3404 Win=61952 Len=0 TSval=3612050518 TSecr=3375534361
168$Mar 28, 2020 23:38:06.000073949 IST$117$68:ff:7b:9c:eb:36$98:22:ef:d5:cc:2f$52.88.91.154$192.168.0.105$6$103$51$443$58314$Change Cipher Spec, Encrypted Handshake Message
169$Mar 28, 2020 23:38:06.000111541 IST$192$98:22:ef:d5:cc:2f$68:ff:7b:9c:eb:36$192.168.0.105$52.88.91.154$6$178$126$58318$443$Client Key Exchange, Change Cipher Spec, Encrypted Handshake Message
170$Mar 28, 2020 23:38:06.001606431 IST$748$98:22:ef:d5:cc:2f$68:ff:7b:9c:eb:36$192.168.0.105$52.88.91.154$6$734$682$58318$443$Application Data
171$Mar 28, 2020 23:38:06.002017047 IST$74$68:ff:7b:9c:eb:36$98:22:ef:d5:cc:2f$52.88.91.154$192.168.0.105$6$60$0$443$58322$443 → 58322 [SYN, ACK] Seq=0 Ack=1 Win=26847 Len=0 MSS=1460 SACK_PERM=1 TSval=3375534363 TSecr=3612050255 WS=256
172$Mar 28, 2020 23:38:06.002055684 IST$66$98:22:ef:d5:cc:2f$68:ff:7b:9c:eb:36$192.168.0.105$52.88.91.154$6$52$0$58322$443$58322 → 443 [ACK] Seq=1 Ack=1 Win=64256 Len=0 TSval=3612050524 TSecr=3375534363
173$Mar 28, 2020 23:38:06.002320872 IST$311$98:22:ef:d5:cc:2f$68:ff:7b:9c:eb:36$192.168.0.105$52.88.91.154$6$297$245$58322$443$Client Hello
174$Mar 28, 2020 23:38:06.004815816 IST$116$68:ff:7b:9c:eb:36$98:22:ef:d5:cc:2f$192.168.0.1$192.168.0.105$17$102$$$$Standard query response 0x4c73 A d1ykf07e75w7ss.cloudfront.net A 13.227.233.86 OPT
175$Mar 28, 2020 23:38:06.005434056 IST$74$98:22:ef:d5:cc:2f$68:ff:7b:9c:eb:36$192.168.0.105$13.227.233.86$6$60$0$60024$443$60024 → 443 [SYN] Seq=0 Win=64240 Len=0 MSS=1460 SACK_PERM=1 TSval=1332820790 TSecr=0 WS=128
176$Mar 28, 2020 23:38:06.018946545 IST$74$68:ff:7b:9c:eb:36$98:22:ef:d5:cc:2f$13.227.233.86$192.168.0.105$6$60$0$443$60024$443 → 60024 [SYN, ACK] Seq=0 Ack=1 Win=28960 Len=0 MSS=1460 SACK_PERM=1 TSval=303854059 TSecr=1332820790 WS=256
177$Mar 28, 2020 23:38:06.019004084 IST$66$98:22:ef:d5:cc:2f$68:ff:7b:9c:eb:36$192.168.0.105$13.227.233.86$6$52$0$60024$443$60024 → 443 [ACK] Seq=1 Ack=1 Win=64256 Len=0 TSval=1332820803 TSecr=303854059
178$Mar 28, 2020 23:38:06.020241820 IST$91$98:22:ef:d5:cc:2f$68:ff:7b:9c:eb:36$192.168.0.105$192.168.0.1$17$77$$$$Standard query 0x3171 A ib.sin1.geoadnxs.com OPT
179$Mar 28, 2020 23:38:06.020730885 IST$91$98:22:ef:d5:cc:2f$68:ff:7b:9c:eb:36$192.168.0.105$192.168.0.1$17$77$$$$Standard query 0x8814 AAAA ib.sin1.geoadnxs.com OPT
180$Mar 28, 2020 23:38:06.021213081 IST$583$98:22:ef:d5:cc:2f$68:ff:7b:9c:eb:36$192.168.0.105$13.227.233.86$6$569$517$60024$443$Client Hello
181$Mar 28, 2020 23:38:06.029144091 IST$105$98:22:ef:d5:cc:2f$68:ff:7b:9c:eb:36$192.168.0.105$192.168.0.1$17$91$$$$Standard query 0xace2 A adserver-eu.adtech.advertising.com OPT
182$Mar 28, 2020 23:38:06.029398819 IST$105$98:22:ef:d5:cc:2f$68:ff:7b:9c:eb:36$192.168.0.105$192.168.0.1$17$91$$$$Standard query 0x190b AAAA adserver-eu.adtech.advertising.com OPT
183$Mar 28, 2020 23:38:06.032434933 IST$219$68:ff:7b:9c:eb:36$98:22:ef:d5:cc:2f$192.168.0.1$192.168.0.105$17$205$$$$Standard query response 0x3171 A ib.sin1.geoadnxs.com A 103.43.90.54 A 103.43.90.178 A 103.43.90.19 A 103.43.90.55 A 103.43.90.20 A 103.43.90.179 A 103.43.90.181 A 103.43.90.180 OPT
184$Mar 28, 2020 23:38:06.036025260 IST$66$68:ff:7b:9c:eb:36$98:22:ef:d5:cc:2f$13.227.233.86$192.168.0.105$6$52$0$443$60024$443 → 60024 [ACK] Seq=1 Ack=518 Win=30208 Len=0 TSval=303854061 TSecr=1332820805
185$Mar 28, 2020 23:38:06.037196494 IST$1514$68:ff:7b:9c:eb:36$98:22:ef:d5:cc:2f$13.227.233.86$192.168.0.105$6$1500$1448$443$60024$Server Hello
186$Mar 28, 2020 23:38:06.037227969 IST$66$98:22:ef:d5:cc:2f$68:ff:7b:9c:eb:36$192.168.0.105$13.227.233.86$6$52$0$60024$443$60024 → 443 [ACK] Seq=518 Ack=1449 Win=64128 Len=0 TSval=1332820821 TSecr=303854061
187$Mar 28, 2020 23:38:06.037581225 IST$2962$68:ff:7b:9c:eb:36$98:22:ef:d5:cc:2f$13.227.233.86$192.168.0.105$6$2948$2896$443$60024$443 → 60024 [ACK] Seq=1449 Ack=518 Win=30208 Len=2896 TSval=303854061 TSecr=1332820805 [TCP segment of a reassembled PDU]
188$Mar 28, 2020 23:38:06.037600113 IST$66$98:22:ef:d5:cc:2f$68:ff:7b:9c:eb:36$192.168.0.105$13.227.233.86$6$52$0$60024$443$60024 → 443 [ACK] Seq=518 Ack=4345 Win=63104 Len=0 TSval=1332820822 TSecr=303854061
189$Mar 28, 2020 23:38:06.039172730 IST$93$98:22:ef:d5:cc:2f$68:ff:7b:9c:eb:36$192.168.0.105$192.168.0.1$17$79$$$$Standard query 0x56cf A e8037.g.akamaiedge.net OPT
190$Mar 28, 2020 23:38:06.039390653 IST$1504$68:ff:7b:9c:eb:36$98:22:ef:d5:cc:2f$13.227.233.86$192.168.0.105$6$1490$1438$443$60024$Certificate, Certificate Status, Server Key Exchange, Server Hello Done
191$Mar 28, 2020 23:38:06.039415620 IST$66$98:22:ef:d5:cc:2f$68:ff:7b:9c:eb:36$192.168.0.105$13.227.233.86$6$52$0$60024$443$60024 → 443 [ACK] Seq=518 Ack=5783 Win=64128 Len=0 TSval=1332820824 TSecr=303854061
192$Mar 28, 2020 23:38:06.043764661 IST$66$98:22:ef:d5:cc:2f$68:ff:7b:9c:eb:36$192.168.0.105$52.88.91.154$6$52$0$58314$443$58314 → 443 [ACK] Seq=1054 Ack=3455 Win=64128 Len=0 TSval=3612050566 TSecr=3375534387
193$Mar 28, 2020 23:38:06.044733570 IST$192$98:22:ef:d5:cc:2f$68:ff:7b:9c:eb:36$192.168.0.105$13.227.233.86$6$178$126$60024$443$Client Key Exchange, Change Cipher Spec, Encrypted Handshake Message
194$Mar 28, 2020 23:38:06.045388269 IST$243$98:22:ef:d5:cc:2f$68:ff:7b:9c:eb:36$192.168.0.105$13.227.233.86$6$229$177$60024$443$Application Data
195$Mar 28, 2020 23:38:06.046136183 IST$93$98:22:ef:d5:cc:2f$68:ff:7b:9c:eb:36$192.168.0.105$192.168.0.1$17$79$$$$Standard query 0x1b8a A hbopenbid.pubmatic.com OPT
196$Mar 28, 2020 23:38:06.046358754 IST$93$98:22:ef:d5:cc:2f$68:ff:7b:9c:eb:36$192.168.0.105$192.168.0.1$17$79$$$$Standard query 0x4afc AAAA hbopenbid.pubmatic.com OPT
197$Mar 28, 2020 23:38:06.046913829 IST$1291$98:22:ef:d5:cc:2f$68:ff:7b:9c:eb:36$192.168.0.105$13.227.233.86$6$1277$1225$60024$443$Application Data
198$Mar 28, 2020 23:38:06.048977190 IST$85$98:22:ef:d5:cc:2f$68:ff:7b:9c:eb:36$192.168.0.105$192.168.0.1$17$71$$$$Standard query 0x57e2 A i.connectad.io OPT
199$Mar 28, 2020 23:38:06.049203682 IST$85$98:22:ef:d5:cc:2f$68:ff:7b:9c:eb:36$192.168.0.105$192.168.0.1$17$71$$$$Standard query 0x84de AAAA i.connectad.io OPT
200$Mar 28, 2020 23:38:06.050774500 IST$230$68:ff:7b:9c:eb:36$98:22:ef:d5:cc:2f$192.168.0.1$192.168.0.105$17$216$$$$Standard query response 0xace2 A adserver-eu.adtech.advertising.com CNAME cs671.wac.thetacdn.net CNAME cs671.lb.wac.apr-1b09e.edgecastdns.net CNAME cs926.wpc.thetacdn.net A 152.199.43.37 OPT
201$Mar 28, 2020 23:38:06.051125125 IST$267$68:ff:7b:9c:eb:36$98:22:ef:d5:cc:2f$192.168.0.1$192.168.0.105$17$253$$$$Standard query response 0x190b AAAA adserver-eu.adtech.advertising.com CNAME cs671.wac.thetacdn.net CNAME cs671.lb.wac.apr-1b09e.edgecastdns.net CNAME cs926.wpc.thetacdn.net SOA ns1.thetacdn.net OPT
202$Mar 28, 2020 23:38:06.051975634 IST$66$68:ff:7b:9c:eb:36$98:22:ef:d5:cc:2f$52.88.91.154$192.168.0.105$6$52$0$443$58314$443 → 58314 [ACK] Seq=3455 Ack=1054 Win=31744 Len=0 TSval=3375534439 TSecr=3612050249
203$Mar 28, 2020 23:38:06.052688027 IST$93$98:22:ef:d5:cc:2f$68:ff:7b:9c:eb:36$192.168.0.105$192.168.0.1$17$79$$$$Standard query 0x2926 AAAA cs926.wpc.thetacdn.net OPT
204$Mar 28, 2020 23:38:06.056058431 IST$118$98:22:ef:d5:cc:2f$68:ff:7b:9c:eb:36$192.168.0.105$192.168.0.1$17$104$$$$Standard query 0xb8dc AAAA perf-optimized-by.rubiconproject.net.akadns.net OPT
205$Mar 28, 2020 23:38:06.057428186 IST$87$98:22:ef:d5:cc:2f$68:ff:7b:9c:eb:36$192.168.0.105$192.168.0.1$17$73$$$$Standard query 0xc762 A ice.360yield.com OPT
206$Mar 28, 2020 23:38:06.057584917 IST$87$98:22:ef:d5:cc:2f$68:ff:7b:9c:eb:36$192.168.0.105$192.168.0.1$17$73$$$$Standard query 0xb01f AAAA ice.360yield.com OPT
207$Mar 28, 2020 23:38:06.061710916 IST$109$68:ff:7b:9c:eb:36$98:22:ef:d5:cc:2f$192.168.0.1$192.168.0.105$17$95$$$$Standard query response 0x56cf A e8037.g.akamaiedge.net A 49.44.205.56 OPT
